	DocName	Text	Agitation	Anger	Fear	Joy	Love	Sadness	Context	ID	label
6098	Der edle Stein Waldow, Hermann	"Gleich jenem edlen Steine faß, o Herz,
Der Freude Strahlen eng in dir zusammen,
Die dir in sonnenhellen Tagen flammen,
Als Talismann, droht Sorge dir und Schmerz;
Als Talismann, der trotz des Winters Macht
Dein Leben schmückt mit Lenz und Blütenpracht —"	0.0	0.0	0.0	1.0	0.0	1.0	"Der edle Stein
Waldow, Hermann Ich hörte jüngst von einem edlen Steine,
Der kühn gewonnen aus der Erde Schacht
Und von dem Strahl der Sonne angelacht,
Die Strahlen alle eng in sich vereine;
Der, wenn sich auf die Fluren, auf die Haine
Mit ihren Schleiern niedersenkt die Nacht,
Ausströmt sein Licht in wunderbarer Pracht,
Verklärend alles rings mit mildem Scheine. — Gleich jenem edlen Steine faß, o Herz,
Der Freude Strahlen eng in dir zusammen,
Die dir in sonnenhellen Tagen flammen,
Als Talismann, droht Sorge dir und Schmerz;
Als Talismann, der trotz des Winters Macht
Dein Leben schmückt mit Lenz und Blütenpracht —"	l00130320	JOY#SADNESS
228	Die Wintersonne Peters, Adolf l0080375	"Du schwebst und schwillst und strömst den ew'gen Morgen
Wie Gott durch alle Himmel hin,
Und tiefe Nacht umhüllt mit Gram und Sorgen
Des Menschen Sinn."	0.0	0.0	0.0	0.0	1.0	1.0	"Tief schläft Natur, in ihrem Flimmerkleide
Unendlich vor mir hingedehnt,
Und meine Seele darbt, die sich im Leide
Nach Leben sehnt. Entlaubte Birken zieh'n im Trauerreigen
Zum Felsensteg, wo im Azure träumt
Die Tanne mit den ewig grünen Zweigen,
Von Schnee gesäumt. Der Wipfel glüht, berührt vom Sonnenballe,
Mein Auge haftet an dem Schein,
Es saugt und trinkt, berauscht vom farb'gen Schwalle,
Trinkt tief ihn ein. Wie ich so still am Sonnenantlitz hange,
Kommt Himmelsfrieden über mich,
Und durstig, selig trink' ich lange, lange —
Schon neigt sie sich. O süßer Lichtstrom, bist du Gottes Helle,
Die mich mit Gluthen übergießt?
Ahmst du die erste Liebe nach, die Quelle,
Die endlos fließt? Du schwebst und schwillst und strömst den ew'gen Morgen
Wie Gott durch alle Himmel hin,
Und tiefe Nacht umhüllt mit Gram und Sorgen
Des Menschen Sinn."	l0080375	LOVE#SADNESS
898	MÄRZABEND ERNST BLASS l0029005	MÄRZABEND	0.0	0.0	0.0	0.0	0.0	0.0	MÄRZABEND	l0029005	NONE
6750	Drei Jahr' sind bald vorbei Katsch, Adolf	"Und wie er dicht nun an uns war
Und guten Morgen bot,
Ward plötzlich Schwester Anna bleich
Und plötzlich wieder rot.
„Wilhelm!“ rief sie — „Anna!“ rief er
Und zog sie an die Brust.
Sie herzten und sie küßten sich
In sel'ger Liebeslust."	1.0	0.0	0.0	1.0	1.0	0.0	"Drei Jahr' sind bald vorbei
Katsch, Adolf Als auf die Wanderschaft ich ging,
Das war des Morgens früh:
Da gaben das Geleite mir
Die Ann' und die Marie.
Die Anne meine Schwester war,
Die trug mein Bündelein;
Marie hing an meinem Arm,
Das war die Liebste mein. Und wo der Weg sich kreuzen thut,
Da standen still wir drei;
Da küßt' ich scheidend die Marie
Und schwur ihr ew'ge Treu.
Ein Wanderbursch des Weges kam,
Der sang gar frisch: „Juchhei!
Drei Jahre mußt' ich wandern wohl,
Drei Jahr' sind bald vorbei.“ Und wie er dicht nun an uns war
Und guten Morgen bot,
Ward plötzlich Schwester Anna bleich
Und plötzlich wieder rot.
„Wilhelm!“ rief sie — „Anna!“ rief er
Und zog sie an die Brust.
Sie herzten und sie küßten sich
In sel'ger Liebeslust."	l00130170	AGITATION#JOY#LOVE
3135	Am Sarge Pichler, Fritz [alt. Pichler, Friedrich]	"Hast du wol solche Leichen schon geschaut,
Die offnen Aug's ...? Du kehrst dich ab? Dir graut?
Du mußt nicht fürchten sie, mußt sie beweinen:
Sie liebten, lebend, ohne Glück; nun kann
Im Tode selbst nicht ruhn der arme Mann,
Sein Aug' ist offen, suchet nach der Einen."	0.0	0.0	1.0	1.0	1.0	1.0	"Am Sarge
Pichler, Fritz [alt. Pichler, Friedrich] Hast du wol solche Leichen schon geschaut,
Die offnen Aug's ...? Du kehrst dich ab? Dir graut?
Du mußt nicht fürchten sie, mußt sie beweinen:
Sie liebten, lebend, ohne Glück; nun kann
Im Tode selbst nicht ruhn der arme Mann,
Sein Aug' ist offen, suchet nach der Einen."	l0020124	FEAR#JOY#LOVE#SADNESS
3917	Recensenten Volkmann, Richard [Pseud. Leander, Richard]	"Alten Zeiten sinn' ich nach, längst verrauschter Fabel —
Eine Ente schwimmt herbei mit profanem Schnabel."	1.0	0.0	0.0	0.0	0.0	0.0	"Recensenten
Volkmann, Richard [Pseud. Leander, Richard] Bläulich breitet sich der See bis zum Firmamente;
Meine Seele dehnt sich weit mit dem Elemente. Alten Zeiten sinn' ich nach, längst verrauschter Fabel —
Eine Ente schwimmt herbei mit profanem Schnabel."	l00160184	AGITATION
549	Am Meer Lieber, Alfred von	"Am Meer
Lieber, Alfred von"	0.0	0.0	0.0	0.0	0.0	0.0	"Am Meer
Lieber, Alfred von"	l0060056	NONE
5192	Gastlichkeit Dräxler, Carl Ferdinand [Pseud. Dräxler-Manfred, Carl]	"Wollte meine Früchte zeigen:
Jungen, kommt im raschen Lauf!
Braucht nicht erst emporzusteigen,
Haltet nur die Taschen auf!"	0.0	0.0	0.0	0.0	0.0	0.0	"Nur herein! Die heitre
Miene würzt das Mahl,
Und die Lust erweitre
Enge Pfähle uns zum Saal. Gottgesandt, willkommen
Sei, o lieber Gast!
Seit du Platz genommen,
Ward die Hütte zum Palast! Blumen giebt's, die sich entfärben
Wenn der Nordwind sie bestreicht;
Gute Werke auch verderben,
Wenn ein finst'rer Blick sie reicht. Darum, geb' ich auch nur wenig,
Geb' ich gern, als froher Mann;
Bin ich doch ein kleiner König,
Wenn ich Andern geben kann! Sollt' ich erst das Glück erreichen
Und mich schatzgesegnet sehn,
Wollt' ich gern dem Obstbaum gleichen
Und in Dorfes Mitte stehn. Wollte meine Früchte zeigen:
Jungen, kommt im raschen Lauf!
Braucht nicht erst emporzusteigen,
Haltet nur die Taschen auf!"	l0080109	NONE
5722	Schutzengel Bleibtreu, Carl [alt. Bleibtreu, Karl]	"Wenn Sinnlichkeit dich unterjocht,
Wenn dir's im Busen kocht und pocht,
Ergreife meine kühle Rechte!
In meinem Spiegel man erkennt,
Mit meinem Messer man zertrennt
Der Leidenschaften Truggeflechte.“"	0.0	0.0	0.0	1.0	1.0	0.0	"Drei Geister nahten diese Nacht,
Die trübe sinnend ich durchwacht.
Mein innres Aug' sah Visionen.
Sie thronen nicht im Sternenzelt:
Sie sind Geschöpfe dieser Welt,
Die als Schutzengel sie bewohnen. Der erste Geist am Lager stand,
Schwarz war sein Haar und sein Gewand,
Und sprach mit monotonem Laute:
„Ich bin der Trost für jeden Schmerz,
Das Herz ich weise himmelwärts,
Das auf der Falschheit Schwüre baute. Bin Vampyr, der aus wunder Brust
Zwar saugt das Blut der Lebenslust,
Doch auch fortfächelt alle Leiden;
Bin Stab, der zur Erkenntniß führt,
Doch welken macht, was er berührt —
Ich bin die Mutter dieser Beiden.“ Sie wies auf jene andern Zwei.
Vortrat die zweite stolz und frei
Mit festem herrschaft-sicherm Tritte.
Sie prahlte nicht mit Prunkgeschmaid,
Nur einen Spiegel hielt die Maid
Und neigte sich in stummer Bitte. „Erwähle mich!“ so rief sie hell.
„Wir kennen uns ja lang, Gesell,
Ich kann dir mehr als jene geben.
Bereitet sie dich vor zum Tod,
So lehre ich trotz aller Noth
Dich tugendhaft und glücklich leben. Wenn Sinnlichkeit dich unterjocht,
Wenn dir's im Busen kocht und pocht,
Ergreife meine kühle Rechte!
In meinem Spiegel man erkennt,
Mit meinem Messer man zertrennt
Der Leidenschaften Truggeflechte.“"	l0070228	JOY#LOVE
7543	Liebe Miegel, Agnes l0030286	"Wieder werd' ich, in Reu und Leid,
Deinen geliebten Namen nennen,
Wieder, wie in verschollener Zeit,
Wird mein Mund nach dem deinen brennen,
Und, die Kerze in zitternder Hand,
Schreit' ich hinab die Treppenstufen —
Wie ein Brautkleid rauscht mein Gewand,
Und mir ist, ich hörte dich rufen..."	0.0	0.0	0.0	0.0	1.0	1.0	"Liebe
Miegel, Agnes Eh' du nicht stirbst in Elend und Not,
Eh' deine Stirn nicht mit Wahnsinn geschlagen —
Keine Rose und Nelke rot
Werde ich mehr im Tanze tragen.
Meine kleinen schneeweißen Schuh',
Die ich getragen bei Reigen und Geigen,
Sollen verstauben in ihrer Truh'
Unter welken Lavendelzweigen. Aber kommt dann endlich der Tag,
Wo sie mir sagen: „Er ist gestorben;
Fluch auf all seinen Wegen lag,
Unstet und flüchtig ist er verdorben“ —
Dann wird lachen mein blasser Mund,
Süß und hell wie in alten Tagen,
Seidene Kleider werd' ich zur Stund',
Ringe und Spangen und Ketten tragen;
Werde tanzen drei Nächte lang,
Rosen im Gürtel und Rosen im Haare —
Während dein Weib, verzweifelnd und bang,
Knieend betet an deiner Bahre. Aber kommt dann die vierte Nacht,
Ist die rote Sonne gegangen,
Dann ist mein Lachen ausgelacht,
Blaß wie der Tod sind dann meine Wangen,
Werde sagen: „Nun liegst du fern,
Tief in der gefrorenen Erde,
Gingest dahin — nicht wie ein Stern,
Loschest aus wie ein Fünkchen am Herde.“ Wieder werd' ich, in Reu und Leid,
Deinen geliebten Namen nennen,
Wieder, wie in verschollener Zeit,
Wird mein Mund nach dem deinen brennen,
Und, die Kerze in zitternder Hand,
Schreit' ich hinab die Treppenstufen —
Wie ein Brautkleid rauscht mein Gewand,
Und mir ist, ich hörte dich rufen..."	l0030286	LOVE#SADNESS
4792	ICH BIN JA NOCH EIN KIND FRANZ WERFEL l00300182	ICH BIN JA NOCH EIN KIND	0.0	0.0	0.0	0.0	0.0	0.0	ICH BIN JA NOCH EIN KIND	l00300182	NONE
6163	Aufschwung Bodman, Emanuel von [alt. Bodman, Emanuel Freiherr von; Bodmann, Emanuel von]	"Die Eiche wächst
Ihren knorrigen Wuchs,
Der Falter fliegt
Durch helle Lüfte,
Ich, soll ich sitzen
Für und für
Und müde Fragen
Einwerfen vor jenes
Große Auge?
Kleb' ich mit Wurzeln
An diesem Fleck?
Ich habe Füße
Zu gehn,
Ich habe Hände
Zu schaffen.
Gehn will ich und schaffen
Mensch unter Menschen
Und alle Lust
Und alles Weh
Genießen
Und meine Seele
Zur Flamme entfalten,
Die golden strahlt
Und ihren Schein
In andere Menschen
Übersprüht,
Damit ihr Bild
In ihnen glänze,
Wenn sie lange sich selber
Gelöscht."	0.0	0.0	0.0	1.0	0.0	1.0	"Aufschwung
Bodman, Emanuel von [alt. Bodman, Emanuel Freiherr von; Bodmann, Emanuel von] Durch den Rahmen
Zweier gewaltigen
Eichenstämme
Glänzt der ferne
See mich an,
Glänzt wie das große
Auge der Welt. Mir schaudert.
Das Auge leuchtete,
Als ich noch war
Im Grün des Waldes,
Im Gold der Sonne,
Im Regentropfen.
Das Auge leuchtet
Über mein Leben.
Das Auge wird leuchten,
Wenn ich zurückgekehrt
Ins Grün der Bäume,
Ins Blau der Luft.
Ich muß verwehn.
Wie diese Blüte,
Wie diese Eiche,
Wie dieser Falter,
Der aus der fließenden
Rinde trinkt.
Warum? Warum! rotzackige
Blüte da
Bin ich nicht Du geworden?
Du Eiche?
Du Falter? Ich weiß es nicht.
Ich wurde Mensch. Die Eiche wächst
Ihren knorrigen Wuchs,
Der Falter fliegt
Durch helle Lüfte,
Ich, soll ich sitzen
Für und für
Und müde Fragen
Einwerfen vor jenes
Große Auge?
Kleb' ich mit Wurzeln
An diesem Fleck?
Ich habe Füße
Zu gehn,
Ich habe Hände
Zu schaffen.
Gehn will ich und schaffen
Mensch unter Menschen
Und alle Lust
Und alles Weh
Genießen
Und meine Seele
Zur Flamme entfalten,
Die golden strahlt
Und ihren Schein
In andere Menschen
Übersprüht,
Damit ihr Bild
In ihnen glänze,
Wenn sie lange sich selber
Gelöscht."	l00170028	JOY#SADNESS
4137	Mondnacht im Gebirge Bube, Adolf	"Da trat ich aus des Waldes tiefem Dunkel
Und sah den Vollmond hinter breiten Matten.
Schräg ging zur Seite mir im Thaugefunkel
Aus freier Eb'ne mein gedehnter Schatten."	0.0	0.0	1.0	0.0	0.0	0.0	"Mondnacht im Gebirge
Bube, Adolf Ich schritt hinunter vom bemoosten Gipfel
Auf jähem Pfade zwischen schlanken Tannen,
Die Sonne schien noch auf die höchsten Wipfel,
Als tief im Thal schon Nacht und Nebel spannen. Bald wogten düstre Schleier mir entgegen
Und schlugen über meinem Haupt zusammen.
Schwer wollte Angst sich auf das Herz mir legen,
Wie Strauch und Baum in Finsterniß verschwammen. Da trat ich aus des Waldes tiefem Dunkel
Und sah den Vollmond hinter breiten Matten.
Schräg ging zur Seite mir im Thaugefunkel
Aus freier Eb'ne mein gedehnter Schatten."	l0080073	FEAR
3653	Sänger und Dichter Weishaupt, Karl	"Einsam rauscht der Wasserfall
Durch die stillen Felder,
Einsam schlägt die Nachtigall
Durch die stummen Wälder;
Jubilirend, lustig leicht,
Einsam durch die Lüfte steigt
Auf der Leiter ihrer Lieder
Froh die Lerche auf und nieder."	0.0	0.0	0.0	1.0	0.0	1.0	"Sänger und Dichter
Weishaupt, Karl Einsam rauscht der Wasserfall
Durch die stillen Felder,
Einsam schlägt die Nachtigall
Durch die stummen Wälder;
Jubilirend, lustig leicht,
Einsam durch die Lüfte steigt
Auf der Leiter ihrer Lieder
Froh die Lerche auf und nieder."	l0020175	JOY#SADNESS
161	3. Meine Augen Zander, Antonie	"3. Meine Augen
Zander, Antonie"	0.0	0.0	0.0	0.0	0.0	0.0	"3. Meine Augen
Zander, Antonie"	l0020178	NONE
7930	DIE MORGUE GEORG HEYM l00300068	"Vorbei ist unsre Zeit. Es ist vollbracht.
Wir sind herunter. Seht, wir sind nun tot.
In weißen Augen wohnt uns schon die Nacht,
Wir schauen nimmermehr ein Morgenrot."	0.0	0.0	0.0	0.0	0.0	0.0	"DIE MORGUE Die Wärter schleichen auf den Sohlen leise,
Wo durch das Tuch es weiß von Schädeln blinkt.
Wir, Tote, sammeln uns zur letzten Reise
Durch Wüsten weit und Meer und Winterwind. Wir thronen hoch auf kahlen Katafalken,
Mit schwarzen Lappen garstig überdeckt.
Der Mörtel fällt. Und aus der Decke Balken
Auf uns ein Christus große Hände streckt. Vorbei ist unsre Zeit. Es ist vollbracht.
Wir sind herunter. Seht, wir sind nun tot.
In weißen Augen wohnt uns schon die Nacht,
Wir schauen nimmermehr ein Morgenrot."	l00300068	NONE
1795	Die Harfe Dehmel, Richard l00170055	"Durch die fünf Finger geht ein zäher Kampf,
als wollten sie sich aneinanderzwängen,
durch ihre Kuppen wühlt und spielt ein Krampf,
als rissen sie mit Inbrunst an den Strängen
einer verwunschnen Harfe."	1.0	0.0	0.0	0.0	0.0	0.0	"Die Harfe
Dehmel, Richard Unruhig steht der hohe Kiefernforst,
die Wolken wälzen sich von Ost nach Westen,
lautlos und hastig ziehn die Krähn zu Horst,
dumpf tönt die Waldung aus den braunen Ästen,
und dumpfer tönt mein Schritt. Hier über diese Hügel ging ich schon,
als ich noch nicht den Sturm der Sehnsucht kannte,
noch nicht bei euerm urweltlichen Ton
die Arme hob und ins Erhabne spannte,
ihr dunkeln Riesen rings. In großen Zwischenräumen, kaum bewegt,
erheben sich die graugewordnen Schäfte,
durch ihre grüngebliebnen Kronen fegt
die Wucht der lauten und verhaltnen Kräfte
wie damals. Und Eine steht, wie eines Erdgotts Hand
in fünf gewaltige Finger hochgespalten,
die glänzt noch goldbraun bis zum Wurzelstand
und langt noch höher als die starren alten
einsamen Stämme. Durch die fünf Finger geht ein zäher Kampf,
als wollten sie sich aneinanderzwängen,
durch ihre Kuppen wühlt und spielt ein Krampf,
als rissen sie mit Inbrunst an den Strängen
einer verwunschnen Harfe."	l00170055	AGITATION
2929	Weißt du noch? Prutz, Robert	"Weißt du noch wie deine Wange röther sich, o Liebste, malte,
Da zuerst ins fromme Auge Blitze dir das meine strahlte?
Wie du rasch dich seitwärts kehrtest, zürnend halb und halb erschrocken,
Da der Athem meines Mundes streifte deine süßen Locken?"	0.0	1.0	1.0	0.0	1.0	1.0	"Weißt du noch?
Prutz, Robert Weißt du noch wie deine Wange röther sich, o Liebste, malte,
Da zuerst ins fromme Auge Blitze dir das meine strahlte?
Wie du rasch dich seitwärts kehrtest, zürnend halb und halb erschrocken,
Da der Athem meines Mundes streifte deine süßen Locken?"	l0080399	ANGER#FEAR#LOVE#SADNESS
6281	Pidder Lüng Liliencron, Detlev von [alt. Liliencron, Detlev Freiherr von; alt. Liliencron, Detlev Frhr. von]	"Bettelpack, fährt ihn der Amtmann an,
Und die Stirnader schwillt dem geschienten Mann.
Du frißt deinen Grünkohl nicht eher auf,
Als bis dein Geld hier liegt zu Hauf.
Der Priester zischelt von Trotzkopf und Bücken
Und verkriecht sich hinter des Eisernen Rücken.
O Wort, geh nicht unter: -
Lewwer duad üs Slaav!"	0.0	1.0	0.0	0.0	0.0	0.0	"Im Schiff vorn der Ritter, panzerbeschwert,
Stützt finster sich auf sein langes Schwert,
Hinter ihm, von der hohen Geistlichkeit,
Steht Jürgen, der Priester, beflissen, bereit.
Er reibt sich die Hände, er bückt den Nacken,
Der Obrigkeit helf' ich, den Frevler zu packen,
In den Pfuhl das Wort:
Lewwer duad üs Slaav. Für Hörnum hat die Prunkbarke den Schnabel gewetzt,
Ihr folgen die Ewer, kriegsvolkbesetzt.
Und es knirschen die Kiele auf den Sand,
Und der Ritter, der Priester springen ans Land,
Und waffenrasselnd hinter den beiden
Entreißen die Söldner die Klingen den Scheiden.
Nun gilt es, Friesen:
Lewwer duad üs Slaav! Die Knechte umzingeln das erste Haus,
Pidder Lüng schaut verwundert zum Fenster hinaus.
Der Ritter, der Priester treten allein
Über die ärmliche Schwelle hinein.
Des langen Peters starkzählige Sippe
Sitzt grad' an der kargen Mittagskrippe.
Jetzt zeige dich, Pidder:
Lewwer duad üs Slaav! Der Ritter verneigt sich mit hämischem Hohn,
Der Priester will erheben seinen Sermon.
Der Ritter nimmt spöttisch den Helm vom Haupt
Und verbeugt sich noch einmal: Ihr erlaubt,
Daß wir euch stören bei euerm Essen,
Bringt hurtig den Zehnten, den ihr vergessen,
Und euer Spruch ist ein Dreck:
Lewwer duad üs Slaav. Da reckt sich Pidder, steht wie ein Baum:
Henning Pogwisch, halt' dein Reden im Zaum,
Wir waren der Steuern von jeher frei,
Und ob du sie wünschst, ist uns einerlei.
Zieh ab mit deinen Hungergesellen,
Hörst du nicht schon meine Hunde bellen?
Und das Wort bleibt stehn:
Lewwer duad üs Slaav! Bettelpack, fährt ihn der Amtmann an,
Und die Stirnader schwillt dem geschienten Mann.
Du frißt deinen Grünkohl nicht eher auf,
Als bis dein Geld hier liegt zu Hauf.
Der Priester zischelt von Trotzkopf und Bücken
Und verkriecht sich hinter des Eisernen Rücken.
O Wort, geh nicht unter: -
Lewwer duad üs Slaav!"	l0010146	ANGER
1281	DAS BAD AUF DEM LANDE MAX BROD l0029012	"Und unvergeßne Angst, Kopfducken, meuchlerisch geplant,
Erholungen, so schnell beim frischen Abendessen,
An die das schöne Liebespaar mich heute mahnt, —
Auch wenn es mich nicht mahnte, ewig unvergessen..."	0.0	0.0	1.0	0.0	1.0	0.0	"Denn wohl sind mir auch solche Nachmittage wohlbekannt,
Von Wasserspiel erfüllt und der Geliebten ganz allein,
Niemanden brauchten wir. Wir stießen ab vom Land,
Ruderten oder schwammen, niemand konnte froher sein. Den Ausgekleideten schien sich die Gegend auch,
Die böhmische, erst jetzt recht zu entschleiern,
Der Wald gab bessres Grün, die Hütte grauem Rauch,
Und wohlverständlicher klang eines Volkslieds fernes Leiern. Die platte Sandbucht bot uns einen süßen Ruheort,
Wo Schilf und Weide unverräterisch zur Wand sich reiht,
O schön an Steinen schwebten wir und flössen fort,
W'as für Umschlingungen im Wasser, welche Leichtigkeit! Die Lippen küßte ich, vom Baden flach und weiß,
Die kalten Lippen, die mir sonst so rot entbrennen.
Auch Zittern kam, jedoch so nah an deinem Leibe heiß
Mocht ich mich nicht vom Wasserfroste trennen. Und die Frisur, die sorgsam du dem Tropfenguß entzogst,
War wie ein Nest, so sonnentrocken und erwärmt,
Und wenn wir beide saßen, du in meinen Schoß den Rücken bogst,
Wie hat sie mich mit festem Strahlenduft umschwärmt. Und unvergeßne Angst, Kopfducken, meuchlerisch geplant,
Erholungen, so schnell beim frischen Abendessen,
An die das schöne Liebespaar mich heute mahnt, —
Auch wenn es mich nicht mahnte, ewig unvergessen..."	l0029012	FEAR#LOVE
4827	Sommerlieder Stern, Adolf	"Wohl regen sich, wenn der Frühling wirbt,
Gefühle noch und Triebe —
Ein eisiger Windhauch — Alles stirbt —
Nirgend Kraft und Liebe!"	1.0	0.0	0.0	0.0	1.0	1.0	"Vom Himmel warmer, goldner Strahl,
Südlichblau die Wellen,
Tiefgrünes Laub durchrauscht das Thal,
Glühende Rosen schwellen! Es drängen sich, im Strahl gereift,
Rings die Halme zu Garben,
So weit das Auge spähend schweift.
Volle Formen und Farben! Zu Blumen schuf des Sommers Gruß
All die Knospen und Blüthen,
Er küßte sie mit glüh'ndem Kuß,
Bis sie selbst erglühten! Laßt ruhen mich in Sommers Zelt,
Daß ich künde und sage:
Es fehlen heut der Menschenwelt
Eben die Sommertage! Ein kurzer Lenz — und Winter dann;
Ein flüchtig laues Beben,
Und eisig tritt der Tod heran —
Nirgend Gluth und Leben! Wohl regen sich, wenn der Frühling wirbt,
Gefühle noch und Triebe —
Ein eisiger Windhauch — Alles stirbt —
Nirgend Kraft und Liebe!"	l0080530	AGITATION#LOVE#SADNESS
4129	Spatz und Spätzin Mayer, Karl	"Bald nun wird der Kirschbaum blühn,
Frühlingszeit ist so vergnüglich;
Ach, wie lieb ich junges Grün
Und die Erbsen ganz vorzüglich!“"	0.0	0.0	0.0	1.0	1.0	0.0	"Spatz und Spätzin
Mayer, Karl Auf dem Dache sitzt der Spatz,
Und die Spätzin sitzt daneben,
Und er spricht zu seinem Schatz:
„Küsse mich, mein holdes Leben! Bald nun wird der Kirschbaum blühn,
Frühlingszeit ist so vergnüglich;
Ach, wie lieb ich junges Grün
Und die Erbsen ganz vorzüglich!“"	l0010155	JOY#LOVE
7067	Wachen in der Nacht Creizenach, Theodor l0080100	"Ich fühl' in ihrer Stärk' und Schwäche
Die eigne Seele bang' und still
Und zittre, wenn des Spiegels Fläche
Mir meinen Schatten zeigen will
Beim Wachen in der Nacht."	0.0	0.0	1.0	0.0	0.0	0.0	"Wachen in der Nacht
Creizenach, Theodor Und hebt mein Geist sich in der grausen,
Geweihten Mitternacht empor,
So tönt die Luft mit leisem Sausen
Wie sanftes Beten an mein Ohr
Beim Wachen in der Nacht. Ich fühl' in ihrer Stärk' und Schwäche
Die eigne Seele bang' und still
Und zittre, wenn des Spiegels Fläche
Mir meinen Schatten zeigen will
Beim Wachen in der Nacht."	l0080100	FEAR
7333	Der Sausewind Naaff, Anton August	"Es hat in stiller Mitternacht
Mein Fensterlein geklirrt,
Wer ist's, wer ist's, den's in der Nacht
Zu meiner Kammer führt?
Du Sausewind, du Brausewind,
Ich hör' und kenn' dich schon; —
Mach' mir mein armes Herz nicht schwer,
Geschwind — mach' dich davon.
Der Sausewind, der Brausewind,
Er hat dazu gelacht,
Und selber sich das Fensterlein
Zur Kammer aufgemacht.
Viel Liebes hat er mir gesagt,
Ich konnt' nicht böse sein,
Mir ward glühheiß und bang dabei
In meinem Kämmerlein.
Frühmorgens, als die Hähne schon
Im ganzen Dorf gekräht,
Da ist er durch das Fensterlein —
Weit — weit davon geweht.
Der Sausewind, der Brausewind,
Er war bei mir zur Nacht,
Er hat mich armes, armes Ding
Um alle Ruh' gebracht!
Und wenn in stiller, stiller Nacht
Mein Fenster manchmal klirrt,
Da wein' ich: Ach, du Sausewind,
Wohin hat's dich geführt?"	0.0	1.0	0.0	1.0	1.0	1.0	"Der Sausewind
Naaff, Anton August Es hat in stiller Mitternacht
Mein Fensterlein geklirrt,
Wer ist's, wer ist's, den's in der Nacht
Zu meiner Kammer führt?
Du Sausewind, du Brausewind,
Ich hör' und kenn' dich schon; —
Mach' mir mein armes Herz nicht schwer,
Geschwind — mach' dich davon.
Der Sausewind, der Brausewind,
Er hat dazu gelacht,
Und selber sich das Fensterlein
Zur Kammer aufgemacht.
Viel Liebes hat er mir gesagt,
Ich konnt' nicht böse sein,
Mir ward glühheiß und bang dabei
In meinem Kämmerlein.
Frühmorgens, als die Hähne schon
Im ganzen Dorf gekräht,
Da ist er durch das Fensterlein —
Weit — weit davon geweht.
Der Sausewind, der Brausewind,
Er war bei mir zur Nacht,
Er hat mich armes, armes Ding
Um alle Ruh' gebracht!
Und wenn in stiller, stiller Nacht
Mein Fenster manchmal klirrt,
Da wein' ich: Ach, du Sausewind,
Wohin hat's dich geführt?"	l0010161	ANGER#JOY#LOVE#SADNESS
7854	Mutterherz Traeger, Albert	"Die Mutter seht mit süßen Schauern,
Die auf dem Arm ihr Kindlein trägt:
So lange wird die Liebe dauern,
So lang ein Mutterherz noch schlägt!
O Mutterherz, du Born der Milde,
Du gottgeweihter, heil'ger Ort,
Haßt auch die Welt, die rauhe, wilde,
In dir weilt still die Liebe fort."	1.0	0.0	0.0	1.0	1.0	0.0	"Mutterherz
Traeger, Albert Ich höre trauern euch und klagen,
Daß kalt die Welt und liebeleer,
Und mitleidsvoll muß ich euch fragen:
Habt ihr denn keine Mutter mehr?
Habt ihr die Mutter schon vergessen,
Das treue Herz, dran ihr geruht,
Den Schooß, drin ihr so weich gesessen,
So sicher, wie in Gottes Hut? Die Mutter seht mit süßen Schauern,
Die auf dem Arm ihr Kindlein trägt:
So lange wird die Liebe dauern,
So lang ein Mutterherz noch schlägt!
O Mutterherz, du Born der Milde,
Du gottgeweihter, heil'ger Ort,
Haßt auch die Welt, die rauhe, wilde,
In dir weilt still die Liebe fort."	l00200296	AGITATION#JOY#LOVE
4410	Korb und Wiege Hesekiel, George	"Doch eh' mir das gelungen,
Das war ein andrer Fall!
Mir ging es ganz erbärmlich
So manches liebe Mal,
Doch hatt' ich's selbst verschuldet,
Sie sagten es auch All',
Fand nirgends eine Wiege,
Doch Körbe überall."	0.0	0.0	0.0	0.0	0.0	1.0	"Korb und Wiege
Hesekiel, George Ich wurde früher geboren,
Als es die Mutter gedacht;
Der Tischler hatte die Wiege
Auch noch nicht gebracht,
Drum ward in aller Eile
Ein Lager mir gemacht
Frisch im Champagnerkorbe —
Wie haben sie da gelacht! Das hing mir an im Leben,
Überall kam ich zu früh,
Und einen Platz bereitet
Fand ich für mich noch nie.
Ich wußte mir aber zu helfen,
Oft war's zum Lachen, wie,
Und als ich's zu was brachte,
Da hieß ich ein Genie. Doch eh' mir das gelungen,
Das war ein andrer Fall!
Mir ging es ganz erbärmlich
So manches liebe Mal,
Doch hatt' ich's selbst verschuldet,
Sie sagten es auch All',
Fand nirgends eine Wiege,
Doch Körbe überall."	l00200199	SADNESS
1822	Freude! Freude! Schüler, Gustav	"So kommt und jauchzt! Das ist des Lebens Sinn.
Denn Angst und Gram und Weinen taugt zu nichts.
Gebt wie ein wunschlos Kind die Seele hin:
So spielt ihr euch hinein ins Meer des Lichts."	0.0	0.0	1.0	1.0	0.0	1.0	"Freude! Freude!
Schüler, Gustav So kommt und jauchzt! Das ist des Lebens Sinn.
Denn Angst und Gram und Weinen taugt zu nichts.
Gebt wie ein wunschlos Kind die Seele hin:
So spielt ihr euch hinein ins Meer des Lichts."	l0030399	FEAR#JOY#SADNESS
