	DocName	Text	Agitation	Anger	Fear	Joy	Love	Sadness	Context	ID	label
1529	Die Königin Keiter, Therese [Pseud. Herbert, M.]	"Und neigten doch vor der Gebiet'rin sich
Und applaudierten mit beschuhter Hand,
Und lobten ihre hohe Meisterschaft
Und ihren königlichen Kunstverstand."	0.0	1.0	0.0	0.0	0.0	0.0	"Die Königin
Keiter, Therese Es saß die Königin steif am Spinett,
Der Reifrock bläht sich weit. Im Haar der Reiher nickt,
Und Diamanten glänzen und Rubin
Am Schneppenmieder, reich mit Gold gestickt,
Die schlanken Finger spielen Menuett,
Ein krächzend Stücklein, hart und ohne Ton.
Sie spielte falsch. Bedford und Leicester sahn
Sich heimlich an. Sie lächelten voll Hohn. Und neigten doch vor der Gebiet'rin sich
Und applaudierten mit beschuhter Hand,
Und lobten ihre hohe Meisterschaft
Und ihren königlichen Kunstverstand."	l00140208	ANGER
2875	Ich komme nach Vogl, Johann Nepomuk l00200098	"In deines Lebens Blüthetagen
Entschwandest du zur stillen Gruft,
Die tief im Herzen ich getragen,
Als wie den Edelstein die Kluft;
Nun bist du mir für immer ferne,
Du Rose, der der Dorn gebrach,
Doch wo du weilst, auf welchem Sterne,
Ich komme nach, ich komme nach!"	0.0	0.0	0.0	1.0	1.0	1.0	"Ich komme nach
Vogl, Johann Nepomuk Fast Alle sind vorausgegangen
An denen meine Seele hing,
Nicht wird sie mehr mein Arm umfangen,
Der sie so liebewarm umfing.
Ach, nimmer aus der Schläfer Kreise
Ruft sie mein heißes Sehnen wach,
Doch mir zum Troste flüstr' ich leise:
Ich komme nach, ich komme nach! In deines Lebens Blüthetagen
Entschwandest du zur stillen Gruft,
Die tief im Herzen ich getragen,
Als wie den Edelstein die Kluft;
Nun bist du mir für immer ferne,
Du Rose, der der Dorn gebrach,
Doch wo du weilst, auf welchem Sterne,
Ich komme nach, ich komme nach!"	l00200098	JOY#LOVE#SADNESS
4820	Warte noch Rodenberg, Julius	"Wasser fließen, Wolken eilen...
Sieh, am Bache erstes Grün!
Liebes Herz, wo wirst du weilen,
Wenn die ersten Rosen blühn?"	0.0	0.0	0.0	0.0	1.0	0.0	"Warte noch
Rodenberg, Julius Warte noch ein kleines Weilchen,
Liebe Sonne, lieber Wind!
Bis die Primeln und die Veilchen
Auf der Wiese kommen sind. Wasser fließen, Wolken eilen...
Sieh, am Bache erstes Grün!
Liebes Herz, wo wirst du weilen,
Wenn die ersten Rosen blühn?"	l0010193	LOVE
3418	Unterwegs Semmig, Hermann	"Wir saßen wie erstarrt, als er zu Ende,
Und scheu und schweigend ging ein Jeder fort;
Er aber drückt' sein Haupt in beide Hände
Und murmelte für sich das düstre Wort:
„Wie er steh' ich auf dieser Welt allein,
Ich möchte wieder heim im Bagno sein.“ —"	1.0	0.0	0.0	0.0	1.0	1.0	"„Und gingen die Geschäfte nur etwas“,
Sprach der Hausirer, „ich tränk' auch ein Glas;
Doch immer größer wird die Noth im Volke.“ Er seufzt' und alle schwiegen wie zuvor.
Auf einmal riesig aus der Tabackswolke
Hob sich der greise Vagabund empor.
Um seine Brauen lag es lange schon
Wie eines Wetters unheimliches Drohn,
Und auf der Stirne seine Ader schwoll,
Und donnernd also jetzt sein Wort erscholl:
„Wo liegt die Quelle von des Volkes Noth?
Im Volke selbst und seinem feigen Dulden!
Wollt ihr nicht ewig eure Noth verschulden,
So ruft verzweifelt aus: Brot oder Tod!
Armsel'ge Zeit, wo statt auf Barrikaden
Zu bluten für sein Recht, der freie Mann
Nur auf der Guillotine sterben kann!
Im Bagno nur bei meinen Kameraden
Lebt wie des Elementes wilde Kraft
Noch ungezähmt und frei die Leidenschaft;
Zurück zu ihnen sehne ich mich wieder,
Ich steh' auf dieser Welt sonst ganz allein,
Fast wie der Greis, der mir fällt eben ein.
Noch rieselt kalt es mir durch alle Glieder,
Denk' ich an das, was ich erzählen will.“ Er setzte sich, wir aber horchten still.
„'s war Neunundachtzig beim Bastillensturm,
Die Glocken heulten wild von jedem Thurm
Und um die alte finstre Zwingburg her
Schwoll heulend wie der Sturm des Volkes Meer ...“ „Ihr war't dabei“, warf froh erstaunt ich ein,
„Ihr kämpftet mit in jenen Heldenreih'n?
Das war ein Volk noch, nicht wie die, so heute
Sich ihres Herr'n verkaufen selbst als Beute;
Das wußte noch zu kämpfen, ja zu sterben,
Sobald es galt die Freiheit zu erwerben.“ „Ich war dabei; ein Knabe von neun Jahren,
Kämpft' ich ein Mann in jenen Heldenscharen.
Heiß brütete der Julisonne Glut,
Doch heißer kochte noch in uns das Blut.
Die Veste fiel; was wird, was muß nicht fallen,
Wenn einig sich ein Volk zum Kampf erbebt!
Wie alles kam, bekannt ist es euch Allen;
Doch höret weiter, was ich da erlebt.
Wildflutend stürzte zügellos die Menge
Sich durch die Höfe, Treppen, Keller, Gänge;
Die Opfer suchten wir der Tyrannei,
Und jubelnd riefen wir: Frei seid ihr, frei!
Aus einem Kerker aber stieg ein Greis,
Verwelkt sein Antlitz und das Haar schneeweiß.
Er starrt' uns an, es war ihm wie ein Traum;
Ans Geh'n längst nicht gewöhnt, vermochten kaum
Die Füße seines Leibes Last zu tragen.
Doch nannt' er Straß' und Haus auf unser Fragen
Nach seiner Wohnung, die nun funfzig Jahre,
Fluch den Tyrannen! er nicht mehr gesehn,
Und Männer trugen ihn auf einer Bahre;
Wie ein Triumphzug war es anzusehn.
Wir kamen an; man öffnete, man frug,
Maß dann mit kalt neugierig fremden Blicken
Den Alten, den man auf der Bahre trug,
Und schüttelte den Kopf. Mit festem Nicken
Bestätigte jedoch der mürbe Greis,
Was er verwirrt fast selbst bezweifelt hätte:
'Ja wohl, hier ist's, ich weiß doch, was ich weiß;
Dies ist mein Haus und meine Heimatsstätte.
Wo ist denn meine Frau?' — Noch Viele kamen,
Doch nicht ein Einz'ger kannte ihren Namen;
Man sprach wol was von einer jungen Frau,
Die plötzlich, als verhaftet ward ihr Gatte,
Der Schmerz aufs Todtenbett geworfen hatte,
Doch wußte Niemand mehr etwas genau.
Dreimal schon war das Haus verkauft indessen
Und wem es sonst gehörte längst vergessen.
Wir fragten in der Nachbarschaft umher,
Umsonst! es kannt' ihn Niemand, Niemand mehr.
Hinstarben seine Freunde Jahr um Jahr,
Indeß er lebend wie begraben war;
Zwei Menschenalter schlossen ihre Reih'n,
Und als er wiederkam, stand er allein.
Da brach aus seiner Brust ein stöhnend Ach,
Und aus den Augen ihm ein Thränenbach.
So stand er in sich schmerzgebrochen da,
Indeß die bleiche Menge auf ihn sah.
Dann zuckt' er wie in Wuth, wie krampfhaft rafft'
Er sich empor: 'Was steht ihr da und gafft?
Fluch eurer Freiheit, die mein Bett mir nahm,
Die in die Wüste mich zu stoßen kam!
Mein Kerker war mein einziges Asyl;
Wo ich daheim, bin ich wie im Exil.
Dort war doch eine Spinne mein Gefährte,
Jetzt aber steh' ich einsam auf der Erde.
Hoch leb' der König, der ein Dach mir gab!
Mir bleibt nun keine Heimat als das Grab!'
Wir wagten nicht der Läst'rung ihn zu zeihn,
Stumm wich die Meng', entsetzt; er blieb allein.
Mitleidig nahm ihn Einer in sein Haus,
Dort haucht' er bald die müde Seele aus.“ — Wir saßen wie erstarrt, als er zu Ende,
Und scheu und schweigend ging ein Jeder fort;
Er aber drückt' sein Haupt in beide Hände
Und murmelte für sich das düstre Wort:
„Wie er steh' ich auf dieser Welt allein,
Ich möchte wieder heim im Bagno sein.“ —"	l0020151	AGITATION#LOVE#SADNESS
7894	Trost Storm, Theodor l00160282	"Trost
Storm, Theodor"	0.0	0.0	0.0	1.0	0.0	0.0	"Trost
Storm, Theodor"	l00160282	JOY
5660	O Mutter Eberhardt-Bürck, Adelheid	"Ihr Arm umfängt dich, wenn dir Kummer naht,
An ihrer Brust beweinst du dein Verschulden,
Sie geht mit dir auf deines Glückes Pfad,
Dein Vorbild ist sie in ergebnem Dulden."	0.0	0.0	0.0	1.0	0.0	1.0	"O Mutter
Eberhardt-Bürck, Adelheid „0 Mutter!“ Ach, wie wecket in der Brust
Des Menschen doch dies Wort ein mächtig Tönen!
Wie führt es oft von höchster Freude Lust
Zu tiefstem Schmerz, zu reuevollem Sehnen! Sie steht vor dir, die freundliche Gestalt,
Du siehst das milde Aug', den Blick voll Liebe,
Vernimmst der Rede fesselnde Gewalt,
Denkst an der Hände Dienst in reinem Triebe. Ihr Arm umfängt dich, wenn dir Kummer naht,
An ihrer Brust beweinst du dein Verschulden,
Sie geht mit dir auf deines Glückes Pfad,
Dein Vorbild ist sie in ergebnem Dulden."	l00130087	JOY#SADNESS
5584	An das 20. Jahrhundert Hart, Heinrich	"Unser Blut treibt neue Säfte,
Unser Mark trinkt neue Kräfte,
Unsre Adern klopfen weit.
Mit einander so zu bauen,
Einig, einig voll Vertrauen,
Heil dem Tag, der so befreit."	0.0	1.0	0.0	1.0	0.0	0.0	"Wo du gehst, da öffnen alle
Tiefen sich mit heißem Schwalle
Und des Abgrunds Nacht wird Tag.
Glühend braust's in tausend Seelen,
Erd' und Himmel zu vermählen,
Dringt der Geist zum Sternenhag. Wo du gehst, quillt Lust und Segen,
Jedem Herzen rauscht's entgegen
Wie des Lenzwinds thauig Warm.
Und der Winter geht zu Ende,
Liebend reichen sich die Hände
Stark und Krank und Reich und Arm. Und von Ost gen Westen fahren
Boten aller Völkerschaaren —
Unsrer Fehde sei's genug.
Kommt, den Gruß uns zu erwidern,
Laßt uns Brüder sein mit Brüdern,
Fahr' zur Hölle Macht und Lug. Schlagt die Cymbeln, spielt die Geigen,
Süße Mädchen schlingt den Reigen,
Kränzt mit Grün den Maienbaum.
Auf, ihr Männer, Opfergluthen
Laßt von allen Bergen fluthen,
Auf, vorbei ist Nacht und Traum. Wie ein Tempel sei die Erde,
Daß der Mensch zum Gotte werde
Todesmächtig, licht und hehr.
Daß nicht Wasser und nicht Lüfte,
Nicht der Zwietracht düstre Klüfte
Trennen unsre Herzen mehr. Unser Blut treibt neue Säfte,
Unser Mark trinkt neue Kräfte,
Unsre Adern klopfen weit.
Mit einander so zu bauen,
Einig, einig voll Vertrauen,
Heil dem Tag, der so befreit."	l0070133	ANGER#JOY
67	Das welke Blatt Hartleben, Otto Erich	"In ihren Locken haftete ein welkes Blatt,
Als ich mit ihr den alten Berg hernieder stieg
Zum letztenmal, verstohlne Freude war es mir,
Das braune Blatt im wirren braunen Haar zu sehn,
Den stillen Zeugen still genoßner, heiliger Lust,
Und heimlich, glücklich lächelnd schritt ich neben ihr,
Indes ein schwellend Säuseln durch die Kronen ging."	0.0	0.0	0.0	1.0	1.0	0.0	"Das welke Blatt
Hartleben, Otto Erich In ihren Locken haftete ein welkes Blatt,
Als ich mit ihr den alten Berg hernieder stieg
Zum letztenmal, verstohlne Freude war es mir,
Das braune Blatt im wirren braunen Haar zu sehn,
Den stillen Zeugen still genoßner, heiliger Lust,
Und heimlich, glücklich lächelnd schritt ich neben ihr,
Indes ein schwellend Säuseln durch die Kronen ging."	l0030156	JOY#LOVE
46	Lieder an Liane Hoechstetter, Sophie	"Du sollst in meiner Mutter schönstem Bett
So ruhig schlafen, bis du nicht mehr müd' —
Und wenn dir dann der junge Tag erglüht,
Wird er dich wecken aus dem Traum der Nacht,
Daß dir erwacht
Der schönere Traum des Lebens."	0.0	0.0	0.0	0.0	1.0	0.0	"Lieder an Liane
Hoechstetter, Sophie Ich wollte einmal dich in meiner Heimat grüßen,
Ich wollte einmal, daß zu deinen Füßen
Die Wege ziehen, die mir lang vertraut.
Ich wollte, daß mein stilles Land dir brächte
Sein tiefes Sehnen, seine hellen Nächte
Und du es sähest, wie ich es geschaut. Ich wollte einmal deine Lippen küssen —
Ich wollte einmal deine lieben, süßen,
Geliebten Augen auf mir ruhen sehn —
Ich wollte einmal — einmal nur dir sagen,
Wie lang dein Bild im Herzen ich getragen,
Und wie es ruht dort bis zum Untergehn. Dann aber? O ich weiß nicht, was noch wäre,
Still ruht die Sehnsucht, — ankerstill im Meere
Fragst du den Beter, was er noch begehrt,
Wenn ihm sein Gott die Seligkeit gewährt?
Fragst du den Schiffer, der den Hafen sieht,
Ob noch ein Wunsch durch seine Seele zieht? Ich wollte einmal deine Lippen küssen,
Ich wollte dich in meinem Hause grüßen —
Einmal mit dir allein sein — fern vom Leben.
Ich wollte einmal dir in erstem Schweigen
Die Heimat und mich selbst ganz dir zu eigen
Bedingungslos in deine Hände geben. Du sollst in meiner Mutter schönstem Bett
So ruhig schlafen, bis du nicht mehr müd' —
Und wenn dir dann der junge Tag erglüht,
Wird er dich wecken aus dem Traum der Nacht,
Daß dir erwacht
Der schönere Traum des Lebens."	l00140053	LOVE
8087	Devise Grosse, Julius [alt. Große, Julius]	"Sechs Dinge sind mir köstlich auf der Welt,
Drum hab' ich meinen Trost auf sie gestellt:
Ein reinlich Glas, ein sonniges Gemüth,
Drin hell der Wein und frisch die Jugend glüht;
Ein feurig Roß und ein beschwingtes Lied,
Drauf königlich der Geist der Liebe zieht;
Gestirnt die Nacht und leuchtend auch dem Gram,
Daß Pfade findet, der so fern ab kam;
Ein blumig Grab, verschwiegen auch der Mund,
Die blühend nur thun ihr Geheimniß kund;
Gedämpft den Schall, umschattet auch das Licht,
Wie es durch hohe Altarfenster bricht;
Doch frei das Feuer und den Sturm voll Macht,
Blieb Asche auch geknickter Wälder Pracht.
Ob Du gestrebt, geliebt mit Lust und Drang,
Fragt einst der Tod, doch fragt er nicht wie lang?"	0.0	0.0	0.0	1.0	1.0	1.0	"Devise
Grosse, Julius Sechs Dinge sind mir köstlich auf der Welt,
Drum hab' ich meinen Trost auf sie gestellt:
Ein reinlich Glas, ein sonniges Gemüth,
Drin hell der Wein und frisch die Jugend glüht;
Ein feurig Roß und ein beschwingtes Lied,
Drauf königlich der Geist der Liebe zieht;
Gestirnt die Nacht und leuchtend auch dem Gram,
Daß Pfade findet, der so fern ab kam;
Ein blumig Grab, verschwiegen auch der Mund,
Die blühend nur thun ihr Geheimniß kund;
Gedämpft den Schall, umschattet auch das Licht,
Wie es durch hohe Altarfenster bricht;
Doch frei das Feuer und den Sturm voll Macht,
Blieb Asche auch geknickter Wälder Pracht.
Ob Du gestrebt, geliebt mit Lust und Drang,
Fragt einst der Tod, doch fragt er nicht wie lang?"	l0080167	JOY#LOVE#SADNESS
4519	Die Todeswürfel Hoffnaaß, Franziska von	"Und aller Blicke fest an Heinrich hangen,
Der steht, die Hand zum Wurfe hoch gehalten.
Und als die Würfel knatternd niedersprangen,
Hat sich der eine jäh entzwei gespalten.
„Sechs — eins — und sechs! so steht es auf drei Steinen.“
Viel hundert Stimmen in Verwundrung brechen ...
Doch Ralph, von Schreck erfaßt, schreit auf mit Weinen:
„Aus Eifersucht beging ich das Verbrechen!“
Der Kurfürst blickt zum Himmel tief betroffen,
Und alles Volk mit ihm die Hände faltet:
„Du machst zu Schanden nicht, die auf dich hoffen;
Du bist der Gott, der als Gerechter waltet.“"	0.0	1.0	1.0	0.0	0.0	1.0	"Der strenge Kurfürst sitzt im Richtersaale,
Von allen Würdenträgern ernst umgeben.
Zwei Würfel liegen in der Marmorschale
Bereit, das Gottesurteil kund zu geben. Bei denen, so zunächst am Throne standen,
War Walter auch, der Waffenschmied. Wie wanken
Die Kniee ihm, da er in Eisenbanden
Die „Zwei“ geführt sieht vor die Richterschranken. Des Fürsten Auge prüfet rings die Hallen:
„Wer“, spricht er scharf nach kurzem Sinnen,
„Die kleinste Zahl wirft, ist dem Tod verfallen,
So will es Gott ... und Ralph hat zu beginnen.“ Dem zuckt es hämisch um den Mund. Mit Lachen
Nimmt er die Würfel — schüttelt — wirft sie nieder:
„Zwei Sechsen! Ha! wer könnt' es besser machen?“
Doch böses Murmeln grollt da hin und wieder. Nun kommt die Reih an Heinrich. Tiefe Stille.
Er knieet zum Gebet: „Mein Gott! durchschauen
Kannst du mein schuldlos Herz! Jedoch dein Wille
Gescheh', in dich nur setz' ich mein Vertrauen!“ Und aller Blicke fest an Heinrich hangen,
Der steht, die Hand zum Wurfe hoch gehalten.
Und als die Würfel knatternd niedersprangen,
Hat sich der eine jäh entzwei gespalten.
„Sechs — eins — und sechs! so steht es auf drei Steinen.“
Viel hundert Stimmen in Verwundrung brechen ...
Doch Ralph, von Schreck erfaßt, schreit auf mit Weinen:
„Aus Eifersucht beging ich das Verbrechen!“
Der Kurfürst blickt zum Himmel tief betroffen,
Und alles Volk mit ihm die Hände faltet:
„Du machst zu Schanden nicht, die auf dich hoffen;
Du bist der Gott, der als Gerechter waltet.“"	l00130422	ANGER#FEAR#SADNESS
1940	Aus der „Flucht nach Ägypten“ Ringseis, Emilie	"War's nicht, als ob das Steinbild
Plötzlich sich geregt,
Als ob die steinernen Augen
Funkelnd es bewegt?
Als ob auf die mächtigen Pranken
Gestemmt es sich höb' empor,
Als träf' ein Zischen und Murren
Der heiligen Wandrer überraschtes Ohr?"	1.0	0.0	0.0	0.0	0.0	0.0	"Aus der „Flucht nach Ägypten“
Ringseis, Emilie In Ägyptens Wüste raget
Ein steinern Rätselbild,
Ein Weib von Antlitz und Busen,
Von Rumpf eine Löwin wild.
So liegt es hingestrecket
Im heißen Wüstensand,
Mit steinernen Augen starrend,
Auf seinem Haupte zittert der Sonnenbrand. Die Sage weiß zu melden,
Vom lebenden Löwenweib,
So vordem hier gehauset
In gräßlichem Zeitvertreib;
Es gab den erschrockenen Wandrern
Dunkele Rätsel auf,
Und wer sie nicht gelöset, —
Die Gebeine dorren zerstreut rings und zuhauf. Nun aber ruht das Steinbild
Im gleißenden Mondenlicht.
Da naht eine Wandrergruppe;
Ein Mann, demütig, schlicht,
Am Leitseil führt ein Lasttier,
Darauf, vom Mantel umwallt,
Eine Mutter sitzt mit dem Kindlein,
Jedoch in zart jungfräulicher Gestalt. War's nicht, als ob das Steinbild
Plötzlich sich geregt,
Als ob die steinernen Augen
Funkelnd es bewegt?
Als ob auf die mächtigen Pranken
Gestemmt es sich höb' empor,
Als träf' ein Zischen und Murren
Der heiligen Wandrer überraschtes Ohr?"	l00130263	AGITATION
460	Am Morgen des Himmelfahrtstages Schwab, Gustav l00200059	"Was die Jünger dort empfanden,
Als ihr Auge flog empor,
Fühl' es, Herz, und aus den Banden
Flüchte durch des Glaubens Thor.
Mit den Ewigkeits-Gedanken
Bist du doch von Erde nur,
Führt nicht er dich aus den Schranken
Über alle Kreatur."	1.0	0.0	0.0	0.0	0.0	0.0	"Am Morgen des Himmelfahrtstages
Schwab, Gustav Laß dich nicht den Frühling täuschen,
Herz, der dich mit Lust umringt,
Wo mit wonnigen Geräuschen,
Wald und Flur von Leben klingt:
Wo sich auf den Ästen wiegen
Kehlen, voll von ew'gem Klang,
Wo, als gäb' es kein Versiegen,
Flüsse brausen ihren Gang. Von den Bäumen, aus den Bächen,
Aus dem hellen Morgenroth
Scheint ein tröstlich Wort zu sprechen —
Lauschest du, so ist's der Tod.
Diese Welt, sie muß vergehen;
Früher noch der Lüfte Raub
Wirst als Asche du verwehen,
Herz, wie flücht'ger Blumenstaub. Willst du bis zum Wesen dringen,
Wende vom Erschaffnen dich,
Willst du dich in's Leben schwingen —
Einer zeigt als Führer sich:
Der an solchem Frühlingsmorgen
Hinter sich ließ die Natur,
Und, dem ird'schen Blick verborgen,
In der Himmel Himmel führ. Was die Jünger dort empfanden,
Als ihr Auge flog empor,
Fühl' es, Herz, und aus den Banden
Flüchte durch des Glaubens Thor.
Mit den Ewigkeits-Gedanken
Bist du doch von Erde nur,
Führt nicht er dich aus den Schranken
Über alle Kreatur."	l00200059	AGITATION
7159	Das ist so Brauch Niendorf, Anton	"Hast gewiß zu warm geliebet,
Armer Himmel, so tief betrübet,
Drum die Thränen im blauen Aug'; —
Das ist so Brauch,
Wenn man liebt, so weint man auch."	0.0	0.0	0.0	0.0	1.0	1.0	"Das ist so Brauch
Niendorf, Anton Wie die Nacht den Himmel droben
Finster mit Wolken hat umwoben!
Thränen weint er, kalt und naß,
— Leichenblaß
Schaut er jetzt durch's Fensterglas. Hast gewiß zu warm geliebet,
Armer Himmel, so tief betrübet,
Drum die Thränen im blauen Aug'; —
Das ist so Brauch,
Wenn man liebt, so weint man auch."	l0080369	LOVE#SADNESS
2	Am Morgen Lingg, Hermann l0080333	"Im Lichte deiner Sterne wähnen
Die treuen Blicke wir zu schau'n,
Die uns verstehn und unsre Thränen."	0.0	0.0	0.0	1.0	0.0	1.0	"Am Morgen
Lingg, Hermann Ich sah dich im azurnen Schleier,
In deinen Rosen, Sommernacht!
Und hab' gewacht in stiller Feier. Im Lichte deiner Sterne wähnen
Die treuen Blicke wir zu schau'n,
Die uns verstehn und unsre Thränen."	l0080333	JOY#SADNESS
3225	Einst wirst du schlummern Traeger, Albert	"Vergehe nicht in Angst und Qual,
Es eilt die Stunde, dich zu retten;
Vier Bretter nur braucht's dünn und schmal,
Ein müdes Menschenherz zu betten."	0.0	0.0	1.0	1.0	0.0	1.0	"Einst wirst du schlummern
Traeger, Albert Ob Nachts auch thränenfeucht dein Pfühl,
Und heiß die ruhelosen Lider,
Einst wirst du schlummern sanft und kühl,
Und keine Sorge deckt dich wieder. Vergehe nicht in Angst und Qual,
Es eilt die Stunde, dich zu retten;
Vier Bretter nur braucht's dünn und schmal,
Ein müdes Menschenherz zu betten."	l00200295	FEAR#JOY#SADNESS
6799	SO SCHNEIT AUF MICH DIE TOTE ZEIT ALBERT EHRENSTEIN l00300025	"So schneit auf mich die tote Zeit.
Danklos trinkt sie den Wein, und was sich beut,
Mein Sehnen darf erlahmen;
Sie wahrt, um Fleisch besorgt, mit plötzlich keuscher Eile
Des Anstands lange Langeweile.
: Weib wird Zeit."	0.0	1.0	0.0	0.0	1.0	1.0	"SO SCHNEIT AUF MICH DIE TOTE ZEIT Hofft nichts von mir.
Ich habe niemals Sonne gehabt,
Ich habe den Steinen mein Leid gebracht.
Ich hoffte Glück vom Tier. An mir vorüber sprang der Wunsch der rasselosen Dirnen,
Und nie klang mir das deutsche Wort: ich liebe dich!
Sie recken dem Kommis die grundlos eiteln Stirnen,
Boshaft gähnt mich das Weib an: ich betrübe dich. So schneit auf mich die tote Zeit.
Danklos trinkt sie den Wein, und was sich beut,
Mein Sehnen darf erlahmen;
Sie wahrt, um Fleisch besorgt, mit plötzlich keuscher Eile
Des Anstands lange Langeweile.
: Weib wird Zeit."	l00300025	ANGER#LOVE#SADNESS
3461	Am Strande des Meeres Eckstein, Ernst	"Aber mild und lächelnd auf die Grüfte
Goß der Lenz die blütenreiche Pracht ...
Melodieen rauschten durch die Lüfte,
Glutgestirne flammten durch die Nacht.
Nun begann die Hoffnung ihren Reigen,
Neu das Leben seinen Lauf ...
Aus des Herbstes halbvergess'nen Leichen
Sproßten tausend Kelche auf!"	0.0	0.0	0.0	1.0	1.0	1.0	"Am Strande des Meeres
Eckstein, Ernst Die du fromm und liebend mich geleitet
Durch des Lebens rätselvolles Land,
Die ums Haupt den Fittich mir gebreitet,
Wenn ich bang am Scheidewege stand:
In des Himmels ungeheurer Leere
Herrlich, wie auf wonnereicher Flur:
Dich begrüß' ich gläubig auch im Meere,
Allgewalt'ge Göttin, o Natur! Wo der Brandung Lilienbrüste schwellen,
Bis die Flut den dunklen Sand betaut;
Wo ins Blau der schaumgekrönten Wellen
Nur die Möwe hoch herniederschaut:
Ach, da schwebt den lichtumwobnen Blicken
Weh und Wonne schattengleich vorbei:
Wo der Gottheit Schauer mich entzücken,
Fühl' ich wieder mich als frei! Manchen Pfad bin sehnend ich gegangen;
Treulich hoffend wand ich mich hinan,
In die sel'gen Thäler zu gelangen
Und das Unvergängliche zu fahn.
Doch umsonst verlangte ich nach Gnade,
Doch vergeblich suchte ich das Glück:
Alle meine wechselvollen Pfade
Führten zur Natur zurück. Dämmernd, wie die Schatten ihrer Wogen,
Lag das Weh auf meinem düstren Sinn:
Um den Himmel fühlt' ich mich betrogen,
Nur die Klage deuchte mir Gewinn;
Alles sah ich sinken und verderben,
Was die Gunst der frohen Stunde gab ...
Alles Leben lebte, um zu sterben,
Selbst die Liebe sank ins Grab. Aber mild und lächelnd auf die Grüfte
Goß der Lenz die blütenreiche Pracht ...
Melodieen rauschten durch die Lüfte,
Glutgestirne flammten durch die Nacht.
Nun begann die Hoffnung ihren Reigen,
Neu das Leben seinen Lauf ...
Aus des Herbstes halbvergess'nen Leichen
Sproßten tausend Kelche auf!"	l00130100	JOY#LOVE#SADNESS
5418	Die stille Stadt Dehmel, Richard l00170058	"Doch als den Wandrer graute,
da ging ein Lichtlein auf im Grund,
und durch den Rauch und Nebel
begann ein leiser Lobgesang
aus Kindermund."	0.0	0.0	1.0	0.0	0.0	0.0	"Die stille Stadt
Dehmel, Richard Liegt eine Stadt im Thale,
ein blasser Tag vergeht;
es wird nicht lange dauern mehr,
bis weder Mond noch Sterne,
nur Nacht am Himmel steht. Von allen Bergen drücken
Nebel auf die Stadt;
es dringt kein Dach, kein Hof noch Haus,
kein Laut aus ihrem Rauch heraus,
kaum Türme noch und Brücken. Doch als den Wandrer graute,
da ging ein Lichtlein auf im Grund,
und durch den Rauch und Nebel
begann ein leiser Lobgesang
aus Kindermund."	l00170058	FEAR
6541	Ballade Des Äusseren Lebens Hofmannsthal, Hugo von [alt. Pseudonym Loris]	"Und Kinder wachsen auf mit tiefen Augen,
Die von nichts wissen, wachsen auf und sterben,
Und alle Menschen gehen ihrer Wege."	0.0	0.0	0.0	0.0	0.0	0.0	"Ballade Des Äusseren Lebens
Hofmannsthal, Hugo von [alt. Pseudonym Loris] Und Kinder wachsen auf mit tiefen Augen,
Die von nichts wissen, wachsen auf und sterben,
Und alle Menschen gehen ihrer Wege."	l00180152	NONE
2133	Ferienweihe Koch, Ernst l0080306	"Die Schwalbe badet in Wolkenlüften
Und verzehrt die Mücken im Sonnenstrahl —
Die Biene badet in Rosendüften
Und schwelgt in ihrem ätherischen Mahl."	0.0	0.0	0.0	0.0	0.0	0.0	"Und erzählt mir alte Geschichten, die wußt' ich
Schon, als ich noch ein Knabe war —
Ich glaube, sie machten sich über mich lustig,
Die Blumen, die Schwalben und der Lorbeer gar! Ach, freilich ist ja der ganze Garten
Eine große lebendige Poesie,
Und ach, es bleiben die Dichtungsarten
Bei der Biene summender Melodie! Curios! ich hab' keine Schule heute:
Drum glaubt' ich, daß es Sonntag wär',
Und horch! es bringen fernes Geläute
Die Morgenwinde zu mir her. So läutet denn, ihr fernen Glocken,
Mir feierlich meine Ferien ein, —
Dann will ich mit der Biene frohlocken
Und fröhlich und frei mit der Schwalbe sein. Die Biene lebt in engem Kreise,
Der Garten nur ist ihre Welt —
Die Schwalben, sie sausen moderner Weise,
Wie der Blitz, durch die Luft über Stadt und Feld. Die Schwalbe badet in Wolkenlüften
Und verzehrt die Mücken im Sonnenstrahl —
Die Biene badet in Rosendüften
Und schwelgt in ihrem ätherischen Mahl."	l0080306	NONE
