	DocName	Text	Agitation	Anger	Fear	Joy	Love	Sadness	Context	ID	label
2833	Auf dem Felde der Ehre Altenbernd, Ludwig	"Heran rollt die Woge, hoch hebt sie den Kahn,
Tief schießt er hinab dann auf schäumender Bahn,
Die Planken, sie krachen und beben.
Jetzt nahe dem Wrack schon — die Ruder gefaßt!
Dort folgen drei Männer am schwankenden Mast
Dem Kampf um Tod und um Leben;
Doch die See übertönt, und der Sturm verweht
Der Hoffnung Ruf und der Angst Gebet."	0.0	0.0	1.0	1.0	0.0	0.0	"Auf dem Felde der Ehre
Altenbernd, Ludwig War das ein Heulen, ein Sturmgebraus
Die ganze Nacht um das Fischerhaus,
Als sollte die Welt schier vergehen!
Den Fischer treibt es im Morgengraun,
Von luftiger Düne hinaus zu schaun,
Ein Fahrzeug vielleicht zu erspähen.
Und wahrlich! dort ferne — er täuscht sich nicht —
In schäumender Brandung ein Wrack in Sicht. Hoch wälzen die Wogen sich über das Schiff,
Das eingekeilt auf dem Felsenriff,
Dem tückischen, längst ihm bekannten.
Der Segel Fetzen, vom Sturm erfaßt,
Wie Möwen flattern sie um den Mast,
Drei Männer, so scheint's, in den Wanten.
Hier gilt kein Säumen: „Ein Schiff in Not!
Herbei, herbei mit dem Rettungsboot!“ Da kommt es, mit sieben Lotsen bemannt;
Wie sicher das Auge, wie fest die Hand
Der wettergestählten Gesellen!
Nicht denken sie lange an Weib und Kind,
Sie prüfen die Brandung, die See, den Wind,
Das Schiff dort in sprühenden Wellen,
Sie müssen's gewinnen, sie müssen hinaus:
„Was sinken, ertrinken! Gott wacht übers Haus!“ Die Brandung rollt, und der Sturmwind braust;
Sie führen die Ruder mit wuchtiger Faust,
Mit Händen von Eisen das Steuer.
Voran nun die Spitze — setzt ein mit Macht!
Du hinten am Steuer, hab acht, hab acht!
Die Woge dort scheint nicht geheuer,
Und trifft sie zur Seite des Bootes Wand,
Tritt nimmer ein Fuß mehr auf trocknen Sand. Heran rollt die Woge, hoch hebt sie den Kahn,
Tief schießt er hinab dann auf schäumender Bahn,
Die Planken, sie krachen und beben.
Jetzt nahe dem Wrack schon — die Ruder gefaßt!
Dort folgen drei Männer am schwankenden Mast
Dem Kampf um Tod und um Leben;
Doch die See übertönt, und der Sturm verweht
Der Hoffnung Ruf und der Angst Gebet."	l00130014	FEAR#JOY
5005	DER GOTT DER STADT GEORG HEYM l00300005	"Vom Abend glänzt der rote Bauch dem Baal,
Die großen Städte knieen um ihn her.
Der Kirchenglocken ungeheure Zahl
Wogt auf zu ihm aus schwarzer Türme Meer."	0.0	1.0	0.0	0.0	0.0	0.0	"DER GOTT DER STADT Auf einem Häuserblocke sitzt er breit.
Die Winde lagern schwarz um seine Stirn.
Er schaut voll Wut, wo fern in Einsamkeit
Die letzten Häuser in das Land verirrn. Vom Abend glänzt der rote Bauch dem Baal,
Die großen Städte knieen um ihn her.
Der Kirchenglocken ungeheure Zahl
Wogt auf zu ihm aus schwarzer Türme Meer."	l00300005	ANGER
111	Natur Henckell, Karl l0070202	"Natur, allheil'ge
Heilende Göttin,
An deinen vollen,
Nährenden Brüsten
Lieg' ich und schlürfe
Milch des Lebens.
Aus deinem Munde
Geht des Windes
Wunderathem
Und löscht mit schnell
Vergang'nen Wetters
Feuchtem Hauch
Der Wangen stürmisch
Aus Herzenstiefen
Steigende Hochgluth.
Deiner Locken
Grüne Fluthen
Wogen rauschend
Über mir,
Und nieder schaut
Dein blaues, klares,
Glänzendes Auge
Wonnig lächelnd.
O, Lebensschauer
Der Weseneinheit,
Verschlung'nes Weben
Des Weltenall's!
Ich seh' es fluthen
In ew'gem Strome,
Ich seh' es wachsen
Zu ew'gem Bau.
Such' ich die Quelle,
So sprüht ein Nebel
Und hüllt den Blick mir,
Und wo begründet,
Des Hauses Pfeiler,
Die Räthselstelle
Ich fand sie nicht.
Und dennoch bet' ich
Voll süßen Grauens
Zu deiner Hoheit,
Mutter Natur
Und schlürfe durstend
An deinen vollen,
Nährenden Brüsten
Milch des Lebens."	1.0	0.0	0.0	1.0	1.0	0.0	"Natur
Henckell, Karl Natur, allheil'ge
Heilende Göttin,
An deinen vollen,
Nährenden Brüsten
Lieg' ich und schlürfe
Milch des Lebens.
Aus deinem Munde
Geht des Windes
Wunderathem
Und löscht mit schnell
Vergang'nen Wetters
Feuchtem Hauch
Der Wangen stürmisch
Aus Herzenstiefen
Steigende Hochgluth.
Deiner Locken
Grüne Fluthen
Wogen rauschend
Über mir,
Und nieder schaut
Dein blaues, klares,
Glänzendes Auge
Wonnig lächelnd.
O, Lebensschauer
Der Weseneinheit,
Verschlung'nes Weben
Des Weltenall's!
Ich seh' es fluthen
In ew'gem Strome,
Ich seh' es wachsen
Zu ew'gem Bau.
Such' ich die Quelle,
So sprüht ein Nebel
Und hüllt den Blick mir,
Und wo begründet,
Des Hauses Pfeiler,
Die Räthselstelle
Ich fand sie nicht.
Und dennoch bet' ich
Voll süßen Grauens
Zu deiner Hoheit,
Mutter Natur
Und schlürfe durstend
An deinen vollen,
Nährenden Brüsten
Milch des Lebens."	l0070202	AGITATION#JOY#LOVE
2268	VERSÖHNUNG ELSE LASKER-SCHÜLER l00300118	"Grenzt nicht mein Herz an deins –
Immer färbt dein Blut meine Wangen rot."	0.0	0.0	0.0	0.0	1.0	0.0	"Es wird ein großer Stern in meinen Schoß fallen ...
Wir wollen wachen die Nacht, In den Sprachen beten,
Die wie Harfen eingeschnitten sind. Wir wollen uns versöhnen die Nacht –
So viel Gott strömt über. Kinder sind unsere Herzen,
Die möchten ruhen müdesüß. Und unsere Lippen wollen sich küssen,
Was zagst du? Grenzt nicht mein Herz an deins –
Immer färbt dein Blut meine Wangen rot."	l00300118	LOVE
2903	Trunkenbold Loens, Hermann	"Man liess mich gehn aus meiner Zelle,
Entschädigung — nicht einen Deut!
Ich trat an meines Hauses Schwelle —
Dort wohnt ein andrer langezeit....
Mein Heim zerstört, mein Weib gestorben,
Mein Sohn verkommen und verdorben,
Die Tochter, davon schweig ich still —
Schnaps her, weil ichs vergessen will!"	0.0	1.0	0.0	0.0	0.0	1.0	"Trunkenbold
Loens, Hermann Ja, lächelt nur und rümpft die Nasen,
Nennt Säufer mich und Trunkenbold,
Erzählts bei Vettern und bei Basen,
Dass ich vom Stuhle sei gerollt,
Erzählt es lachend meinetwegen,
Dass in der Gosse ich gelegen,
Ich bin ein ruinirter Mann —
Schnaps her, dass ichs vergessen kann! Was hilfts mir, dass es mir gelungen
Durch meiner Hände Eisenkraft,
Nachdem ich Jahr und Tag gerungen.
Dass Haus und Hof ich mir geschafft?
O, könnt ich es doch ganz vergessen,
Dass Weib und Kinder ich besessen,
O Kinderlachen, Weibeskuss —
Schnaps her, weil ichs vergessen muss! Zehn Jahre Zuchthaus — neun gesessen —
Neun Jahre öder Kerkersnacht !
Mir ward die Strafe zugemessen,
Ein andrer hat die That vollbracht.
Herrgott, warum hast du geduldet,
Dass ich gebüsst und nichts verschuldet,
Dass ich ein kraftgebrochner Mann —
Schnaps her, dass ichs vergessen kann! Man liess mich gehn aus meiner Zelle,
Entschädigung — nicht einen Deut!
Ich trat an meines Hauses Schwelle —
Dort wohnt ein andrer langezeit....
Mein Heim zerstört, mein Weib gestorben,
Mein Sohn verkommen und verdorben,
Die Tochter, davon schweig ich still —
Schnaps her, weil ichs vergessen will!"	l0050008	ANGER#SADNESS
5108	1917 WALTER HASENCLEVER l00300211	"Tritt mit der Posaune des Jüngsten Gerichts
Hervor, o Mensch, aus tobendem Nichts!"	1.0	0.0	0.0	0.0	0.0	0.0	"Empfange die ungeliebte Qual
Aller Verstoßnen in diesem Mal. Ein letztes Aug, das am Äther trinkt,
Den Ruf, der in Verdammnis sinkt; Die brennende Wildnis der schreienden Luft,
Den rohen Stoß in die kalte Gruft. Wenn etwas in deiner Seele bebt,
Das dies Grauen noch überlebt, So laß es wachsen, auferstehn
Zum Sturm, wenn die Zeiten untergehn. Tritt mit der Posaune des Jüngsten Gerichts
Hervor, o Mensch, aus tobendem Nichts!"	l00300211	AGITATION
8068	Mein Dämon — weißt du noch — der wilde Traum? Preuschen, Hermione von [alt. Preuschen-Telmann, Hermine von]	"Wie Tiger eines mit dem anderen rang —
Und dann zu seliger Einheit sich umschlang. —"	1.0	0.0	0.0	0.0	1.0	0.0	"Wir saßen einsam, hoch auf dem Balkon,
Er war wie unsres Glückes erzener Thron. Blauschillerseide floß um meine Glieder —,
Auf die den Mund du preßtest immer wieder. Dann klang „Sakuntala“ dir von den Lippen,
Den süßen, brennenden Korallenklippen, An denen langsam die Vernunft versank
Und tief vom Taumelkelch der Sinne trank. In fieberschwangern Dschungelfinsternissen,
Die Krallen tief ins wilde Herz gerissen, Wie Tiger eines mit dem anderen rang —
Und dann zu seliger Einheit sich umschlang. —"	l00140060	AGITATION#LOVE
3846	Trost in Schmerzen Prutz, Robert [alt. Prutz, Robert Eduard]	"Und alles Weh, das seit der ersten Stunde
Der Menschheit Brust durchwühlt mit bangem Sehnen,
Es brennt in meiner Seele Grunde
Und lindert sich in milden Thränen."	0.0	0.0	0.0	0.0	1.0	1.0	"Da, bei dem düstern Glanz der Trauerkerzen,
Hab' ich zuerst begriffen und empfunden,
Dass es ein Glück auch giebt der Schmerzen
Und dass auch Rosen blühn aus Wunden. Als hätt' erst jetzt die Welt sich mir erschlossen,
Seitdem mein Auge überquillt von Zähren,
So seh' ich tausend Leidgenossen,
Die meine Trauer mir verklären. Wie anders jetzt nach frühverblühtem Lenze
Berührt die welke Blume mich am Wege,
Seit ich die winterlichen Kränze
Auf einen theuern Hügel lege! Wie anders hör' die Nachtigall ich schlagen,
Wie anders hallt mir's aus der Lerche Chören,
Seitdem man ihn dahingetragen,
Der keine Lerche mehr wird hören! Ja selbst am Himmel dort die ewgen Sterne,
Sie scheinen inniger mir zuzuwinken,
Seit ich in grenzenlose Ferne
Ein leuchtend Antlitz sah versinken. Und alles Weh, das seit der ersten Stunde
Der Menschheit Brust durchwühlt mit bangem Sehnen,
Es brennt in meiner Seele Grunde
Und lindert sich in milden Thränen."	l00160230	LOVE#SADNESS
1471	ICH FLAMME DAS GASLICHT AN … ERNST WILHELM LOTZ l00300088	"Und versinke in eisdurchwehte Nächte.
Und weiß, der Tod reckt unten seine Arme aus. –
Doch über mich hin fährt ein Gebraus
Springender Hufen und Leiber und sonnhafter Prächte und Mächte!"	0.0	0.0	0.0	0.0	0.0	0.0	"ICH FLAMME DAS GASLICHT AN … Ich flamme das Gaslicht an.
Aufrollendes Staunen umprallt die vier Zimmerwände.
Ich fühle mich dünn in der Mitte stehn,
Verkrampft in Taschen klein meine Hände,
Und muß dies alles sehn: Die Mauern bauchen aus, von Dröhnen geschwellt:
Die Tafeln von Jahrtausend-Meistern dröhnen in ihren Flanken,
Von Halleluja-Geistern hinziehend musizierende Gedanken!
Ich erblicke mich schwimmend klein da hinein gestellt
Mit winzigem Stöhnen und Krampf
Vor solchem wogenhaft wuchtenden Tönen
Und solchem siegsicher schwingenden Wolkenkampf! O so Gott zwingende Werke!
Ein spitzer Pinselstrich zerstiebt mich blind
Mit machtheiterm Wind und lässiger Stärke! Meine Brust empört sich über dies brausende Sein.
Tief ziehe ich die Luft der Wände ein
– Diese Flut, diese Glut! –
Und stoße sie aus mir mit Husten und Speien:
Blut! Blut! Und versinke in eisdurchwehte Nächte.
Und weiß, der Tod reckt unten seine Arme aus. –
Doch über mich hin fährt ein Gebraus
Springender Hufen und Leiber und sonnhafter Prächte und Mächte!"	l00300088	NONE
4296	Die Maske fort! Bredig, Katharina	"Ich habe mit Gewalt erstickt,
Was mein Gemüt bewegte,
So manchem Unsinn zugenickt,
Der Widerspruch erregte."	1.0	1.0	0.0	0.0	0.0	0.0	"Die Maske fort!
Bredig, Katharina Ich habe die Komödie satt!
Muß endlich mich befreien,
Was mich so lang gefoltert hat,
Mir von der Seele schreien! So wißt: ich habe oft gelacht
Ein schmerzlich falsches Lachen,
Mit Ekel Phrasen auch gemacht
Wie andre Leute machen! Ich habe mit Gewalt erstickt,
Was mein Gemüt bewegte,
So manchem Unsinn zugenickt,
Der Widerspruch erregte."	l00140132	AGITATION#ANGER
7573	Noch einen Gang Reisewitz, Gustav	"'s ist trübe Nacht, und ungesehn
Ans Älterngrab ich trete,
Die Trauerweiden hör' ich wehn,
Sie flüstern wie leise Gebete;
Zur vollen Weihrauchwolke schwillt
Der Duft der Lilienblüte,
Ein wehmuthsschweres Seufzen quillt
Schmerzlich aus meinem Gemüthe."	0.0	0.0	0.0	0.0	1.0	1.0	"Noch einen Gang
Reisewitz, Gustav Noch einen Gang, einen schweren Gang
Hab' ich zu thun:
Die alte, düstre Mauer entlang,
Wo die Todten ruhn,
Zu einem Grab ohne Kreuz und Stein,
Wo keine Cypressen klagen;
Man senkte hier zwei Herzen ein,
Die heiß für mich geschlagen. 's ist trübe Nacht, und ungesehn
Ans Älterngrab ich trete,
Die Trauerweiden hör' ich wehn,
Sie flüstern wie leise Gebete;
Zur vollen Weihrauchwolke schwillt
Der Duft der Lilienblüte,
Ein wehmuthsschweres Seufzen quillt
Schmerzlich aus meinem Gemüthe."	l0020137	LOVE#SADNESS
2773	Zur Dämmerstunde war's — Lingen, Thekla	"Sie suchte dich —
Wie dufteten die Rosen!
Und lechzend barg ich mein Gesicht hinein
Und sog die süßen, süßen Düfte ein —
Wie fühlt' ich deine Wünsche mich umkosen!"	0.0	0.0	0.0	0.0	1.0	0.0	"Zur Dämmerstunde war's —
Lingen, Thekla Zur Dämmerstunde war's,
Zur schlimmen Zeit —
Und deine Rosen dufteten im Zimmer,
Ins Fenster brach der letzte Abendschimmer —
Und meine Sehnsucht ging so weit. Sie suchte dich —
Wie dufteten die Rosen!
Und lechzend barg ich mein Gesicht hinein
Und sog die süßen, süßen Düfte ein —
Wie fühlt' ich deine Wünsche mich umkosen!"	l00170153	LOVE
6876	„Täubchen, das...“ Lasker-Schüler, Else l0030250	"Mein Herz ist die tote Mutter,
Und meine Augen sind traurige Kinder,
Die über die Lande gehen."	0.0	0.0	0.0	0.0	0.0	1.0	"„Täubchen, das...“
Lasker-Schüler, Else „Täubchen, das in seinem eignen Blute schwimmt.“ Als ich also diese Worte an mich las,
Erinnerte ich mich
Tausend Jahre meiner. Eisige Zeiten verschollen — Leben vom Leben,
Wo liegt mein Leben —
Und träumt nach meinem Leben. Ich lag allen Tälern im Schoß,
Umklammerte alle Berge,
Aber nie meine Seele wärmte mich. Mein Herz ist die tote Mutter,
Und meine Augen sind traurige Kinder,
Die über die Lande gehen."	l0030250	SADNESS
226	Die Wintersonne Peters, Adolf l0080375	"Wie ich so still am Sonnenantlitz hange,
Kommt Himmelsfrieden über mich,
Und durstig, selig trink' ich lange, lange —
Schon neigt sie sich."	0.0	0.0	0.0	1.0	0.0	0.0	"Die Wintersonne
Peters, Adolf Tief schläft Natur, in ihrem Flimmerkleide
Unendlich vor mir hingedehnt,
Und meine Seele darbt, die sich im Leide
Nach Leben sehnt. Entlaubte Birken zieh'n im Trauerreigen
Zum Felsensteg, wo im Azure träumt
Die Tanne mit den ewig grünen Zweigen,
Von Schnee gesäumt. Der Wipfel glüht, berührt vom Sonnenballe,
Mein Auge haftet an dem Schein,
Es saugt und trinkt, berauscht vom farb'gen Schwalle,
Trinkt tief ihn ein. Wie ich so still am Sonnenantlitz hange,
Kommt Himmelsfrieden über mich,
Und durstig, selig trink' ich lange, lange —
Schon neigt sie sich."	l0080375	JOY
6979	Das letzte Lied Lindner, Anton l00170152	"Im bleichen Lichte krümmt sich die Chaussee
So müde zwischen weißen Meilensteinen,
In Pappelkronen flüstert Winterweh..
Und bei dem Teiche, wo die Weiden weinen,
Zittert ein Sensenlied, zittert und stirbt."	0.0	0.0	0.0	0.0	0.0	1.0	"Das letzte Lied
Lindner, Anton Die Sonne schläft, der Sommer geht zur Ruh,
Schon schwätzt der Kieselbach, die Räder rauschen;
Die Sehnsucht schließt die großen Augen zu,
Schläft lächelnd ein.. Dort, wo die Wälder lauschen,
Zittert ein Sensenlied, zittert und stirbt. Im bleichen Lichte krümmt sich die Chaussee
So müde zwischen weißen Meilensteinen,
In Pappelkronen flüstert Winterweh..
Und bei dem Teiche, wo die Weiden weinen,
Zittert ein Sensenlied, zittert und stirbt."	l00170152	SADNESS
3817	Flocken Bodman, Emanuel von [alt. Bodman, Emanuel Freiherr von; Bodmann, Emanuel von]	"Leise, leise fallen weiße Flocken,
Fall'n wie einstens, als dein Fuß mit Beben
In mein Haus trat, als ich hell erschrocken
Ahnte, daß ein Wunder sich begeben..."	1.0	0.0	1.0	0.0	0.0	0.0	"Flocken
Bodman, Emanuel von [alt. Bodman, Emanuel Freiherr von; Bodmann, Emanuel von] Leise, leise fallen weiße Flocken,
Fall'n wie einstens, als dein Fuß mit Beben
In mein Haus trat, als ich hell erschrocken
Ahnte, daß ein Wunder sich begeben..."	l0030028	AGITATION#FEAR
7762	Zwei Proletarier Sigismund, Berthold	"Ich werde spurlos von hinnen gehn,
Nichts, was ich schaffe, wird bestehn.
Mein Leben gleicht den Wellenringen,
Die um den Stein im See sich schlingen;
Es verschwimmt die letzte Kräutselspur,
Und spiegelglatt ist der blanke Azur.
Ein Neuer kommt, der mich belacht;
Der neuen Lehrer neues Wissen
Hat alten Glauben eingerissen,
Er geht ans Werk mit erträumter Macht.
Wird dir nicht besser gehn, hab' Acht! —"	0.0	1.0	0.0	0.0	0.0	0.0	"Ich habe mir's sauer werden lassen
Bei der Lampe geisterbleichem Strahl,
Im düstern Stüblein, in dumpfen Classen;
Im grausigen, schaurigen Leichensaal
Hab' ich studirt, wenn draußen die Sonne
Mit goldenen Fäden zog die Menge
Aus der schattig düsteren Straßen Enge
In die grünende, jubelnde Maienwonne.
Den sonnigen Morgen, die sternige Nacht
Hab' ich dienend im Lazarethe verbracht;
Zuschauen mußt' ich an Leidensbetten,
Wo den Dulder die gräßliche Schlange umringt,
Am Ufer stand ich, und konnte nicht retten
Den Armen, den wirbelnd der Strudel verschlingt.
Anhören mußt' ich der Mutter Klagen
Um des lieben Sohnes brechendes Herz:
Gott weiß, was ich lernte in jungen Tagen,
Ich hab' es erkauft mit bitterem Schmerz. Er lernte vom Vater hauen den Stein,
Und hat er gefugt der Quader Bau,
Dann zeigt er's mit Stolz der lächelnden Frau:
Dies ist mein Werk, ich erbaut' es allein! O könnt' ich, wie er, stolz preisen mein Thun,
Wie er, am Abend zufrieden ruhn!
Ich weiß, am belobten Meisterstück
Vollbrachte das Beste das blinde Glück.
Ihr rühmet die rettende Kunst so viel,
Die umschattete Augen zum Licht ließ genesen;
Und doch ist's ein rollendes Würfelspiel,
Verdienstlos bin ich Gewinner gewesen.
Das Mütterlein legte mir ohne Bangen
Ihr Kleinod in die Arme zum Schutz,
Ich hielt's, wie mein eigenes Kind, umfangen,
Da entriß mir's der Räuber mit höhnischem Trutz.
O grauer Nebel der Wissenschaft,
Von schwachem Flimmern trüb erhellt,
Du machst die Ohnmacht nicht zur Kraft,
Herr bleibt der Tod auf der Erdenwelt! — Ich schreit' entgegen dem Kämmerlein,
Dem einsamen, ohne süßes Behagen.
Mein wartet nicht freundlichen Lichtes Schein,
Kein heiterer Gruß wird Willkommen mir sagen.
Fast preis' ich mich glücklich, daß ich allein
Mich habe durch's rauhe Leben zu schlagen.
Meines Lebens schmales, leichtes Boot
Trägt seinen Steuermann nur zur Noth. Er aber, der formet zum Quader den Stein,
Behaglich sitzt er im eignen Kahn.
Und setzt ihm das Schicksal noch mehr hinein,
Er rudert sie durch auf der schwankenden Bahn.
Flachsköpfige Buben, sie wachsen schnell,
Bald tragen sie ihm das Essen hinaus,
Und spielen im Steinbruch den Maurergesell.
Er lehrt sie des Schlägels und Meißels Gebrauch,
Bald werden sie seiner Arbeit Genossen,
Bald schaffen als rüstige Maurer sie auch,
Und klimmen empor des Handwerks Sprossen.
Er kann sie nach seinem Herzen gewöhnen,
Und lebt noch Menschenalter fort
In seinen Söhnen und ihren Söhnen.
Treu erbet sich fort des Vaters Wort,
Gleich einem alten köstlichen Buch;
Der Enkel lernet vom Vater wieder
Großvaters fröhliche Wanderlieder,
Des Alten kernigen Lieblingsspruch. Ich werde spurlos von hinnen gehn,
Nichts, was ich schaffe, wird bestehn.
Mein Leben gleicht den Wellenringen,
Die um den Stein im See sich schlingen;
Es verschwimmt die letzte Kräutselspur,
Und spiegelglatt ist der blanke Azur.
Ein Neuer kommt, der mich belacht;
Der neuen Lehrer neues Wissen
Hat alten Glauben eingerissen,
Er geht ans Werk mit erträumter Macht.
Wird dir nicht besser gehn, hab' Acht! —"	l0080517	ANGER
3668	Mutter und Kind Hetzer, Lina	"Als der Frühling wiederkehrte,
Sank die Mutter auch ins Grab;
So der Blumen reichste Fülle
Trägt sie ihrem Kind hinab."	0.0	0.0	1.0	0.0	0.0	0.0	"Mutter und Kind
Hetzer, Lina Mutter, Mutter, bring mir Blumen,
Leg sie auf mein Bettchen her,
Mit den Blumen will ich spielen,
Andres Spiel mag ich nicht mehr! — Ach, mein Liebling, wie so gerne
Brächt' ich recht viel Blumen dir,
Doch der Frühling ist noch ferne,
Kalt und eisig ist es hier! — Stille legt das Kind sein Köpfchen
Auf das weiche Kissen hin,
Engel mit den schönsten Blumen
Sieht es da vorüberziehn. Und mit süßem Lächeln reichen
Sie ihm alle Blumen hin,
Und die Mutter, bang erschauernd,
Sieht ihr Kind zu Engeln fliehn. Als der Frühling wiederkehrte,
Sank die Mutter auch ins Grab;
So der Blumen reichste Fülle
Trägt sie ihrem Kind hinab."	l00130420	FEAR
4184	Keim und Kind Ebert, Karl Egon von [alt. Ebert, Egon]	"Doch wenn ein holdes Kind ich sehe,
Gewiegt von treuer Mutterhand,
Halb ist's noch in des Himmels Nähe,
Noch Gast und Fremdling unser'm Land,
Ein tief Geheimniß dieser Erden,
Das erst die Zukunft einst erklärt,
Ein Räthsel, eine Welt im Werden,
Die im Gestaltungskampfe gährt —
Wenn ich es seh', ein solches Wesen,
Da faßt ein Sturm mich von Gefühl,
In seinen Zügen möcht' ich lesen,
Was einst sein Loos im Weltgewühl;
Wird's glücklich sein, wird's Glück gewähren?
Das Aug', das jetzt so selig wacht,
Wird's nicht, erfüllt von bittern Zähren,
Durchwachen manche lange Nacht?
Das Kind, wenn Mann einst, wird es wirken
Für's Heil der Menschheit ernst und kühn,
Wird's, wenn es Weib, in den Bezirken
Des engern Hauses freudig blüh'n?
Wird's nicht vielleicht die Welt erschüttern,
Vielleicht vergessen untergeh'n?
Wird man es lieben, vor ihm zittern,
Wird auch ein Herz sein Herz versteh'n?"	1.0	0.0	1.0	1.0	1.0	1.0	"Keim und Kind
Ebert, Karl Egon von [alt. Ebert, Egon] Wenn ich den kleinen Keim betrachte,
Aus dem einst frisch die Pflanze dringt,
Aus dem, wenn Lebensgluth erwachte,
Die bunte Blume sich entschwingt,
Aus dem ein Heilkraut sich entfaltet,
Aus dem ein Fruchtbaum sich erhebt,
Aus dem die Eiche sich gestaltet,
Die riesig auf gen Himmel strebt:
Dann tief im innersten Gemüthe
Bestaun' ich still die hohe Kraft,
Die Frucht erweckt aus Keim und Blüthe,
Im Kleinsten wirkt und Größtes schafft;
Und allen Keimen wünsch' ich Segen,
Und guten Grund in Feld und Au',
Und Sonnenschein und milden Regen,
Und warme Nächt' und kühlen Thau. Doch wenn ein holdes Kind ich sehe,
Gewiegt von treuer Mutterhand,
Halb ist's noch in des Himmels Nähe,
Noch Gast und Fremdling unser'm Land,
Ein tief Geheimniß dieser Erden,
Das erst die Zukunft einst erklärt,
Ein Räthsel, eine Welt im Werden,
Die im Gestaltungskampfe gährt —
Wenn ich es seh', ein solches Wesen,
Da faßt ein Sturm mich von Gefühl,
In seinen Zügen möcht' ich lesen,
Was einst sein Loos im Weltgewühl;
Wird's glücklich sein, wird's Glück gewähren?
Das Aug', das jetzt so selig wacht,
Wird's nicht, erfüllt von bittern Zähren,
Durchwachen manche lange Nacht?
Das Kind, wenn Mann einst, wird es wirken
Für's Heil der Menschheit ernst und kühn,
Wird's, wenn es Weib, in den Bezirken
Des engern Hauses freudig blüh'n?
Wird's nicht vielleicht die Welt erschüttern,
Vielleicht vergessen untergeh'n?
Wird man es lieben, vor ihm zittern,
Wird auch ein Herz sein Herz versteh'n?"	l0080118	AGITATION#FEAR#JOY#LOVE#SADNESS
2476	Des Kaisers Traum Gerhardt, Dagobert von [Pseud. Amyntor, Gerhard von]	"Der Schemen schwindet, und des Lämpchens Schein
Erlischt; doch hold verklärt ein strahlend Lächeln
Des Träumers Antlitz, der sich noch allein
In finstrer Höhle wähnt. — Ein frisches Fächeln
Geht draußen durch den Park; der Nebel sinkt;
Der Vögel Jubelchor die Sonne feiert;
Demantenhell der Havel Spiegel blinkt,
Und Fahrlands Forst bei Sakrow steht entschleiert."	1.0	0.0	0.0	1.0	0.0	0.0	"Denn jenes Münsters nationales Werk
Erzählt, was Deutschlands ein'ge Stämme schufen;
Es überhöht Ägyptens Gräberberg,
Der Cheops-Pyramide Schwindelstufen.
Hoch ragt Sankt Peters Kuppelbau in Rom,
Und Rom sah lang' die Welt zu Füßen liegen,
Doch höher ragt zu Köln der deutsche Dom,
Und deutscher Geist wird einst die Welt besiegen. Und nun, mein Fürst, den letzten Wunsch erfahrt,
Der noch mich bannt aus der Entschlaf'nen Reihen:
All Deutschland rüstet sich zur Pilgerfahrt
Nach Köln am Rhein, der Türme Knauf zu weihen;
Gebt diesem Fest durch Eure Gegenwart
Die wahre Deutung! rüstet Euch zur Reise!
Der deutsche Dom des deutschen Kaisers harrt —
Den Schlußstein fügt auf kaiserliche Weise!“ — Der Rotbart schweigt; der Held im weißen Bart
Ruft: „Diesen Wunsch will freudig ich erfüllen!
Der Kaiser darf beim Feste einz'ger Art
Sein Angesicht dem Volke nicht verhüllen.
Schürt blinder Eifer auch noch manchen Brand,
Und schleppt der Wahn zum Brande dürre Reiser,
Doch stehn die Besten all' im Vaterland
Ohn' Unterschied des Glaubens um den Kaiser.“ — „Habt Dank, mein Held! Und was ich künde jetzt,
Es ist Prophetenwort und wird geschehen:
Nach tausend Jahren noch wird unverletzt
Der deutschen Einheit Kathedrale stehen!
Nach tausend Jahren wird zum Jubelfest
Des Doms ein Sproß von Eurem Stamme wallen,
Und weil sich deutsche Treu nicht brechen läßt,
Wird Gott und ihm ein Lobgesang erschallen! Des Morgenlandes Weise sprach die Gunst
Der Kirche heilig: so spricht uns und Euern
Gekrönten Bruder heilig einst die Kunst,
Und unsre Namen wird der Ruhm verteuern;
Des Doms Begründer und das Fürstenpaar,
Das ihn gefördert und zum Ziel geführet,
Als Dreigestirn sie leuchten immerdar,
So lang' ein Menschenwerk die Herzen rühret!“ — Der Schemen schwindet, und des Lämpchens Schein
Erlischt; doch hold verklärt ein strahlend Lächeln
Des Träumers Antlitz, der sich noch allein
In finstrer Höhle wähnt. — Ein frisches Fächeln
Geht draußen durch den Park; der Nebel sinkt;
Der Vögel Jubelchor die Sonne feiert;
Demantenhell der Havel Spiegel blinkt,
Und Fahrlands Forst bei Sakrow steht entschleiert."	l00130020	AGITATION#JOY
