	DocName	Text	Agitation	Anger	Fear	Joy	Love	Sadness	Context	ID	label
1269	DAS BAD AUF DEM LANDE MAX BROD l0029012	"Ihr Glücklichen! — Ich sah das Liebespaar,
Das heiße Licht schien wohnlich, wenn sie lachten,
Die platte Fähre bot sich wie ein Zimmer dar,
Ein schattiges, in dem vertraut des Mädchens Miederhüften krachten."	0.0	0.0	0.0	1.0	1.0	0.0	"DAS BAD AUF DEM LANDE Ihr Glücklichen! — Ich sah das Liebespaar,
Das heiße Licht schien wohnlich, wenn sie lachten,
Die platte Fähre bot sich wie ein Zimmer dar,
Ein schattiges, in dem vertraut des Mädchens Miederhüften krachten."	l0029012	JOY#LOVE
4189	Papa Opitz: Schlaf, Johannes	"Papa Opitz:
Schlaf, Johannes"	0.0	0.0	0.0	0.0	0.0	0.0	"Papa Opitz:
Schlaf, Johannes"	l00100092	NONE
1990	Nachtigallenlied Leander, Richard	"Nachtigallenlied
Leander, Richard"	0.0	0.0	0.0	0.0	0.0	0.0	"Nachtigallenlied
Leander, Richard"	l0010130	NONE
2252	Erst seit Du mein geworden Berthold, Gustav	"Erst seit Du mein geworden,
Däucht mir das Leben werth,
Und lächelt mir aller Orten,
Zu seliger Lust verklärt."	0.0	0.0	0.0	1.0	1.0	0.0	"Erst seit Du mein geworden
Berthold, Gustav Erst seit Du mein geworden,
Däucht mir das Leben werth,
Und lächelt mir aller Orten,
Zu seliger Lust verklärt."	l0080056	JOY#LOVE
6571	Sehnsucht Weiß, Emil Rudolf	"Schmerz und Trost der Schmerzen,
bist in einem mir —
oft am langen Tage
seufz' ich ach! nach dir."	0.0	0.0	0.0	1.0	0.0	1.0	"Sehnsucht
Weiß, Emil Rudolf Oft am langen Tage
seufz' ich ach! nach dir,
fühl' ich dich mir nahe,
sprech' ich so mit dir. In der kühlen Frühe
aufgewacht zu mir,
fühl' ich, was uns trennet,
seufz' ich ach! nach dir. Seh' dein Auge schauen
liebevoll zu mir,
schaut mich an und weilet
einen Blick bei mir. Geht von mir am Tage,
kommt zurück zu mir,
wenn ich nach dir klage,
schweigend und in mir. Schmerz und Trost der Schmerzen,
bist in einem mir —
oft am langen Tage
seufz' ich ach! nach dir."	l0030432	JOY#SADNESS
5717	Schutzengel Bleibtreu, Carl [alt. Bleibtreu, Karl]	"Drei Geister nahten diese Nacht,
Die trübe sinnend ich durchwacht.
Mein innres Aug' sah Visionen.
Sie thronen nicht im Sternenzelt:
Sie sind Geschöpfe dieser Welt,
Die als Schutzengel sie bewohnen."	0.0	0.0	0.0	0.0	0.0	1.0	"Schutzengel
Bleibtreu, Carl [alt. Bleibtreu, Karl] Drei Geister nahten diese Nacht,
Die trübe sinnend ich durchwacht.
Mein innres Aug' sah Visionen.
Sie thronen nicht im Sternenzelt:
Sie sind Geschöpfe dieser Welt,
Die als Schutzengel sie bewohnen."	l0070228	SADNESS
2859	Ach, du fliehst vergebens Geibel, Emanuel	"Muth, der sturmentgegen
Neuen Pfad sich bahnt,
Demuth, die den Segen
Auch im Trübsal ahnt."	0.0	0.0	0.0	0.0	0.0	0.0	"Ach, du fliehst vergebens,
Was dich härmt und kränkt;
Keinem wird des Lebens
Bittrer Zoll geschenkt. Wenn der erste süße
Jugendleichtsinn schwand,
Bleibt dir an die Füße
Stets ein Weh gebannt. Zu den höchsten Matten,
Unter's stillste Dach
Wandelt, wie dein Schatten,
Dir die Sorge nach; Mischt zu jedem Glanze
Sich als Nebel still,
Nagt an jedem Kranze,
Der dir blühen will; Bis du, unter Schmerzen,
An durchkämpftem Tag
Dir errangst im Herzen,
Was sie bänd'gen mag: Muth, der sturmentgegen
Neuen Pfad sich bahnt,
Demuth, die den Segen
Auch im Trübsal ahnt."	l00200157	NONE
3459	Am Strande des Meeres Eckstein, Ernst	"Manchen Pfad bin sehnend ich gegangen;
Treulich hoffend wand ich mich hinan,
In die sel'gen Thäler zu gelangen
Und das Unvergängliche zu fahn.
Doch umsonst verlangte ich nach Gnade,
Doch vergeblich suchte ich das Glück:
Alle meine wechselvollen Pfade
Führten zur Natur zurück."	0.0	0.0	0.0	1.0	1.0	0.0	"Am Strande des Meeres
Eckstein, Ernst Die du fromm und liebend mich geleitet
Durch des Lebens rätselvolles Land,
Die ums Haupt den Fittich mir gebreitet,
Wenn ich bang am Scheidewege stand:
In des Himmels ungeheurer Leere
Herrlich, wie auf wonnereicher Flur:
Dich begrüß' ich gläubig auch im Meere,
Allgewalt'ge Göttin, o Natur! Wo der Brandung Lilienbrüste schwellen,
Bis die Flut den dunklen Sand betaut;
Wo ins Blau der schaumgekrönten Wellen
Nur die Möwe hoch herniederschaut:
Ach, da schwebt den lichtumwobnen Blicken
Weh und Wonne schattengleich vorbei:
Wo der Gottheit Schauer mich entzücken,
Fühl' ich wieder mich als frei! Manchen Pfad bin sehnend ich gegangen;
Treulich hoffend wand ich mich hinan,
In die sel'gen Thäler zu gelangen
Und das Unvergängliche zu fahn.
Doch umsonst verlangte ich nach Gnade,
Doch vergeblich suchte ich das Glück:
Alle meine wechselvollen Pfade
Führten zur Natur zurück."	l00130100	JOY#LOVE
3108	Der Tod der Nachtigall Schack, Adolf Friedrich Graf von [alt. Schack, Adolf Friedrich von]	"Im weichen Mondlicht vom Balkone
Wie oft dir lauscht' ich andachtsvoll,
Wenn aus der grünen Blätterkrone
Dein heilges Lied herüberscholl."	0.0	0.0	0.0	0.0	0.0	1.0	"Der Tod der Nachtigall
Schack, Adolf Friedrich Graf von [alt. Schack, Adolf Friedrich von] Du, die unsterblich, vom Geschlechte
Der Feen und Elfen ich geglaubt,
O holde Freundin meiner Nächte,
So hat der Tod dich mir geraubt! Im weichen Mondlicht vom Balkone
Wie oft dir lauscht' ich andachtsvoll,
Wenn aus der grünen Blätterkrone
Dein heilges Lied herüberscholl."	l00160242	SADNESS
3091	DER TODESENGEL JAKOB VAN HODDIS l00300074	"Posaunenschall und dunkler Donner lachen.
Ein Schleier überflog das Morgenrot.
Als sie mit ihrer zärtlichen und schwachen
Bewegung ihm den Mund zum Küssen bot."	0.0	0.0	0.0	1.0	1.0	0.0	"Die Augen weit, vor Mitleid glühend offen
Wie trostlos starrend hin zu neuer Lust,
Ein grauenvolles, nie versiegtes Hoffen,
Ein Traum von Tagen, die er nie gewußt.
Er kommt aus einer Höhle, wo ein Knabe
Ihn als Geliebte wunderzart umfing.
Er flog durch seinen Traum als Schmetterling
Und ließ ihn Meere sehn als Morgengabe. Und Lüfte Indiens, wo an Fiebertagen
Das greise Meer in gelbe Buchten rennt.
Die Tempel, wo die Priester Cymbeln schlagen,
Um Öfen tanzend, wo ein Mädchen brennt. Sie schluchzt nur leise, denn der Schar Gesinge
Zeigt ihr den Götzen, der auf Wolken thront
Und Totenschädel trägt als Schenkelringe,
Der Flammenqual mit schwarzen Küssen lohnt. Betrunkne tanzen nackend zwischen Degen,
Und einer stößt sich in die Brust und fällt.
Und während blutig sich die Schenkel regen,
Versinkt dem Knaben Tempel, Traum und Welt.
Dann flog er hin zu einem alten Manne
Und kam ans Bett als grüner Papagei.
Und krächzt das Lied: «O schmähliche Susanne!»
Die längst vergeßne Jugendlitanei. Der stiert ihn an. Aus Augen glasig blöde
Blitzt noch ein Strahl. Ein letztes böses Lächeln
Zuckt um das zahnlose Maul. Des Zimmers Öde
Erschüttert jäh ein lautes Todesröcheln.
Die Braut friert leise unterm leichten Kleide.
Der Engel schweigt. Die Lüfte ziehn wie krank.
Er stürzt auf seine Knie. Nun zittern beide.
Vom Strahl der Liebe, der aus Himmeln drang. Posaunenschall und dunkler Donner lachen.
Ein Schleier überflog das Morgenrot.
Als sie mit ihrer zärtlichen und schwachen
Bewegung ihm den Mund zum Küssen bot."	l00300074	JOY#LOVE
4498	Die Mittelmässigen Seidel, Heinrich	"Die Musik ist heutzutage
Wohl der Menschheit grösste Plage:
Schauervolles wird erreicht,
Wenn der Mensch die Geige streicht
Oder um die Abendröte
Zwecklos bläst auf einer Flöte;
Und ich hege die Vermutung,
Dass auch der Posaune Tutung
Manchem wohl bei Tag und Nacht
Keine grosse Freude macht.
Dieser schlägt mit viel Gebimbel
Grausamlich das Klavezimbel,
Jener aber, gnadenlos,
Kneift das Cello — Gott ist gross!
Seine Langmut ist unendlich,
Treibts der Mensch auch noch so schändlich!"	0.0	1.0	0.0	0.0	0.0	0.0	"Die Mittelmässigen
Seidel, Heinrich Die Musik ist heutzutage
Wohl der Menschheit grösste Plage:
Schauervolles wird erreicht,
Wenn der Mensch die Geige streicht
Oder um die Abendröte
Zwecklos bläst auf einer Flöte;
Und ich hege die Vermutung,
Dass auch der Posaune Tutung
Manchem wohl bei Tag und Nacht
Keine grosse Freude macht.
Dieser schlägt mit viel Gebimbel
Grausamlich das Klavezimbel,
Jener aber, gnadenlos,
Kneift das Cello — Gott ist gross!
Seine Langmut ist unendlich,
Treibts der Mensch auch noch so schändlich!"	l0050011	ANGER
4438	Pierrot Schaukal, Richard l0090071	"Das ist der alte Vollmondträumer nicht,
Der unsern Vätern durch die Thüre lachte.
Tot ist sein Witz, das Licht, das er uns brachte.
Heute schreckt uns sein Gespenst, so bleich und licht."	0.0	0.0	1.0	1.0	0.0	0.0	"Pierrot
Schaukal, Richard Das ist der alte Vollmondträumer nicht,
Der unsern Vätern durch die Thüre lachte.
Tot ist sein Witz, das Licht, das er uns brachte.
Heute schreckt uns sein Gespenst, so bleich und licht."	l0090071	FEAR#JOY
5700	Heidemoor Schleker, Klara	"Denn ihr Hauch löscht aus alle Jugendkraft,
Daß jäh deine Lippe das Lachen vergißt,
Daß stumm du dich beugst in des Grames Haft,
Bis Liebe, Hoffen und Leidenschaft
So welk und tot wie die Heide ist."	0.0	0.0	0.0	1.0	1.0	1.0	"Heidemoor
Schleker, Klara Öd ist es und wüst ist es rings umher,
Öd ist es und fahl in der Heide Gebiet,
Wo moorige Rinnsale langsam und schwer
Die Wasser schleppen hinunter ins Meer,
Die verkrüppeltes Zwergholz am Ufer umkniet. O trauriges Land voll Nebelgequalm,
Das selten die Sonne in Himmelsblau schaut!
Gespenstisch im Rohre rauscht Halm an Halm,
Wenn die Frösche beginnen den Abendpsalm,
Wenn der Dunst um Heide und Ginster braut. Das ist im Lande die böse Stund,
Da hebt sich empor, was Ruhe nicht fand,
Da sucht nach Worten der Toten Mund,
Zu tun ihr Leid den Lebendigen kund —
Und wehe jeglichem, der sie verstand! Denn ihr Hauch löscht aus alle Jugendkraft,
Daß jäh deine Lippe das Lachen vergißt,
Daß stumm du dich beugst in des Grames Haft,
Bis Liebe, Hoffen und Leidenschaft
So welk und tot wie die Heide ist."	l00140102	JOY#LOVE#SADNESS
6769	Der Abenteurer Hartleben, Otto Erich [alt. Hartleben, O. Erich; Hartleben, Erich]	"Der Huftritt meines Rosses klingt an morsch Gebein,
An Menschenschädel — mich zu schrecken sind sie wohl
Vom Schicksal auf des Reiches Schwelle ausgestreut?
Zerstampfe sie, mein Schwarzer, stampfe über sie hinweg:
Sie waren nicht, der ich bin — darum fielen sie."	0.0	0.0	1.0	0.0	0.0	0.0	"Der Abenteurer
Hartleben, Otto Erich Hier ist das Land. So rudert denn den Kahn zurück
Und meldet den Gefährten: Ich betrat mein Reich,
Als Fürsten sehen sie mich wieder, oder nie. —
Was steht ihr noch und zaudert? Laßt mich nun allein,
Allein mit meinem guten Schwert und meinem Roß —
Nun werb' ich in der Fremde mir die eigene Schar. —
Lebt wohl! — dem wandelbaren Meere kehr' ich heut'
Den Rücken zu — mein Auge sucht die Burgen auf,
In deren Mauern sich der Feige sicher fühlt.
Mein Auge sucht am Horizonte seinen Feind. — Der Huftritt meines Rosses klingt an morsch Gebein,
An Menschenschädel — mich zu schrecken sind sie wohl
Vom Schicksal auf des Reiches Schwelle ausgestreut?
Zerstampfe sie, mein Schwarzer, stampfe über sie hinweg:
Sie waren nicht, der ich bin — darum fielen sie."	l0030164	FEAR
6400	Ganz im Geheimen Königsbrunn-Schaup, Franz von [alt. Königsbrun-Schaup; Königsbrunn-Schaup]	"Stehn vor den Leuten wir,
Sprichst du kein Wort zu mir,
Bleibst ach so stolz und fern
Und hast mich doch so gern —
Ganz im Geheimen."	0.0	0.0	0.0	1.0	1.0	0.0	"Ganz im Geheimen
Königsbrunn-Schaup, Franz von [alt. Königsbrun-Schaup; Königsbrunn-Schaup] Stehn vor den Leuten wir,
Sprichst du kein Wort zu mir,
Bleibst ach so stolz und fern
Und hast mich doch so gern —
Ganz im Geheimen."	l0010125	JOY#LOVE
4166	Ich harre aus Dorgeel, Heinrich	"Was ist dein Lohn? — Ich frage nicht;
Genug, daß er zum Kampfe mich erkoren!
Und ruft er mich dereinst vor sein Gericht,
Und ward ich nicht zum Kampfe bloß geboren:
Dann, Feldherr, bin vor dir ich nicht verloren."	1.0	0.0	0.0	0.0	0.0	0.0	"Ich harre aus
Dorgeel, Heinrich Wem diene ich? — Ich weiß es nicht,
Ich kenn' ihn nicht, der mich hierher gesendet;
Doch auszuharren, das ist meine Pflicht!
Und wenn sich alles gegen mich auch wendet,
Ich harre aus, bis er die Wache endet. Ich kämpf' wofür? Ich weiß es nicht!
Ihr mögt darum mich einen Söldner schelten.
Doch tief im Herzen eine Stimme spricht:
Es kann nur etwas Großem, Gutem gelten,
Zum Kampfe rief der Schöpfer mich der Welten! Was ist dein Lohn? — Ich frage nicht;
Genug, daß er zum Kampfe mich erkoren!
Und ruft er mich dereinst vor sein Gericht,
Und ward ich nicht zum Kampfe bloß geboren:
Dann, Feldherr, bin vor dir ich nicht verloren."	l00130082	AGITATION
3621	Lützows wilde Jagd Körner, Carl Theodor	"Die wilde Jagd, und die deutsche Jagd,
Auf Henkersblut und Tyrannen! —
Drum, die ihr uns liebt, nicht geweint und geklagt;
Das Land ist ja frei, und der Morgen tagt,
Wenn wir's auch nur sterbend gewannen!
Und von Enkeln zu Enkeln sei's nachgesagt:
Das war Lützow's wilde verwegene Jagd."	0.0	0.0	0.0	0.0	1.0	1.0	"Was glänzt dort vom Walde im Sonnenschein?
Hör's näher und näher brausen.
Es zieht sich herunter in düsteren Reih'n,
Und gellende Hörner schallen darein
Und erfüllen die Seele mit Grausen.
Und wenn ihr die schwarzen Gesellen fragt:
Das ist Lützow's wilde verwegene Jagd. Was zieht dort rasch durch den finstern Wald,
Und streift von Bergen zu Bergen?
Es legt sich in nächtlichen Hinterhalt;
Das Hurrah jauchzt und die Büchse knallt,
Es fallen die fränkischen Schergen.
Und wenn ihr die schwarzen Jäger fragt:
Das ist Lützow's wilde verwegene Jagd. Wo die Reben dort glühen, dort braust der Rhein,
Der Wüthrich geborgen sich meinte;
Da naht es schnell mit Gewitterschein,
Und wirft sich mit rüst'gen Armen hinein,
Und springt an's Ufer der Feinde.
Und wenn ihr die schwarzen Schwimmer fragt:
Das ist Lützow's wilde verwegene Jagd. Was braust dort im Thale die laute Schlacht,
Was schlagen die Schwerter zusammen?
Wildherzige Reiter schlagen die Schlacht,
Und der Funke der Freiheit ist glühend erwacht
Und lodert in blutigen Flammen.
Und wenn ihr die schwarzen Reiter fragt:
Das ist Lützow's wilde verwegene Jagd. Wer scheidet dort röchelnd vom Sonnenlicht
Unter winselnde Feinde gebettet?
Es zuckt der Tod auf dem Angesicht;
Doch die wackern Herzen erzittern nicht,
Das Vaterland ist ja gerettet!
Und wenn ihr die schwarzen Gefallnen fragt:
Das war Lützow's wilde verwegene Jagd. Die wilde Jagd, und die deutsche Jagd,
Auf Henkersblut und Tyrannen! —
Drum, die ihr uns liebt, nicht geweint und geklagt;
Das Land ist ja frei, und der Morgen tagt,
Wenn wir's auch nur sterbend gewannen!
Und von Enkeln zu Enkeln sei's nachgesagt:
Das war Lützow's wilde verwegene Jagd."	l00200057	LOVE#SADNESS
4801	ICH BIN JA NOCH EIN KIND FRANZ WERFEL l00300182	"Bis daß ich erst in jedem Lumpen starb,
In jeder Katz’ und jedem Gaul verreckte,
Und ein Soldat, im Wüstendurst verdarb.
Bis, grauser Sünder ich, das Sakrament weh auf der Zunge schmeckte,
Bis ich den aufgefreßnen Leib aus bitterm Bette streckte,
Nach der Gestalt, die ich verhöhnt umwarb!"	0.0	1.0	0.0	0.0	0.0	1.0	"Nie war ich Seemann, wenn das Öl ausgeht,
Wenn die tausend Wasser die Sonne verhöhnen,
Wenn die Notschüsse dröhnen,
Wenn die Rakete zitternd aufsteht.
Nie warf ich mich, Dich zu versöhnen,
O Herr, aufs Knie zum letzten Weltgebet. Nie war ich ein Kind, zermalmt in den Fabriken
Dieser elenden Zeit, mit Ärmchen, ganz benarbt!
Nie hab’ ich im Asyl gedarbt,
Weiß nicht, wie sich Mütter die Augen aussticken,
Weiß nicht die Qual, wenn Kaiserinnen nicken,
Ihr alle, die ihr starbt, ich weiß nicht, wie ihr starbt! Kenn’ ich die Lampe denn, kenn’ ich den Hut,
Die Luft, den Mond, den Herbst und alles Rauschen
Der Winde, die sich überbauschen,
Ein Antlitz böse oder gut?
Kenn’ ich der Mädchen stolz und falsches Plauschen?
Und weiß ich, ach, wie weh ein Schmeicheln tut? Du aber, Herr, stiegst nieder, auch zu mir.
Und hast die tausendfache Qual gefunden,
Du hast in jedem Weib entbunden,
Und starbst im Kot, in jedem Stück Papier,
In jedem Zirkusseehund wurdest Du geschunden,
Und Hure warst Du manchem Kavalier! O Herr, zerreiße mich!
Was soll dies dumpfe, klägliche Genießen?
Ich bin nicht wert, daß Deine Wunden fließen.
Begnade mich mit Martern, Stich um Stich!
Ich will den Tod der ganzen Welt einschließen.
O Herr, zerreiße mich! Bis daß ich erst in jedem Lumpen starb,
In jeder Katz’ und jedem Gaul verreckte,
Und ein Soldat, im Wüstendurst verdarb.
Bis, grauser Sünder ich, das Sakrament weh auf der Zunge schmeckte,
Bis ich den aufgefreßnen Leib aus bitterm Bette streckte,
Nach der Gestalt, die ich verhöhnt umwarb!"	l00300182	ANGER#SADNESS
857	Trotzkopf Schuster, Friedrich Wilhelm	"Ich hasse, und hasse mit glühender Kraft —
Vor allem die Feinde des Schönen
Und jeden, dem es Freude schafft,
Die Würde des Menschen zu höhnen;
Die hass' ich mit wilder, flammender Glut
Und sag' es mit frohem, offenem Mut:
Ich lasse mich nicht versöhnen."	0.0	1.0	0.0	0.0	1.0	0.0	"Trotzkopf
Schuster, Friedrich Wilhelm Mich hat zu einer eigenen Art
Die Mutter Natur geboren.
So hab' ich mich treu bis heute bewahrt
Zum Trotze den Weisen und Thoren.
Und was sie auch reden hin und her,
Das ändert und wandelt mich nimmermehr;
Ihr Reden ist verloren. Ich liebe im ganzen vollen Sinn
Und bin dem Geliebten ergeben
Mit allem, was ich habe und bin,
Mit meinem Wollen und Streben.
Mein Lieben ist tief und echt und wahr,
Verschmolzen im Innern ganz und gar
Mit meinem eigensten Leben. Ich hasse, und hasse mit glühender Kraft —
Vor allem die Feinde des Schönen
Und jeden, dem es Freude schafft,
Die Würde des Menschen zu höhnen;
Die hass' ich mit wilder, flammender Glut
Und sag' es mit frohem, offenem Mut:
Ich lasse mich nicht versöhnen."	l00130447	ANGER#LOVE
4913	Im Eisenhammer Marx, Friedrich	"Ist's auf dem Thron der Unterwelt
Fürst Pluto, ist's der Böse?
Hu, wie das zischt und pfeift und gellt,
Auf dass ein Fluch sich löse!
O komm, des Wassers Segensmacht,
Wie himmlisches Verzeihen,
Aus dieser Hölle Feuerschacht
Die Geister zu befreien!"	0.0	0.0	1.0	0.0	0.0	0.0	"Im Eisenhammer
Marx, Friedrich Ein Knabe war ich, wild und froh,
Entflohn der dunklen Kammer,
Da ging's im sausenden Halloh
Hinab zum Eisenhammer.
Die Sterne leuchteten zu schön
Noch über Alpenjochen,
Das Thal erfüllte mit Gedröhn
Der Hämmer dumpfes Pochen. Da stand ich in der Öfen Schein,
Blaugelbe Höllen flammten;
Die Bälge schnaubten, stöhnten drein,
Wie Ächzen der Verdammten.
Gigantisch an der Bretterwand
Der Hütte war, o Grauen,
Im hellen Schein, der kam und schwand,
Ein Schattenbild zu schauen! Ist's auf dem Thron der Unterwelt
Fürst Pluto, ist's der Böse?
Hu, wie das zischt und pfeift und gellt,
Auf dass ein Fluch sich löse!
O komm, des Wassers Segensmacht,
Wie himmlisches Verzeihen,
Aus dieser Hölle Feuerschacht
Die Geister zu befreien!"	l00160218	FEAR
2746	Nachtleben Förster, Marie	"Als blieb von Lenz und Glück und Licht
Allein er unbewegt,
Als würde seine Seele nicht
Zu Lieb' und Lust erregt."	0.0	0.0	0.0	1.0	1.0	0.0	"Nachtleben
Förster, Marie Viel Blumen sehn ins Tageslicht,
So traumesstill hinein,
Als rührte sie der Frühling nicht
Mit seinem Sonnenschein. Doch in der Nacht erwachen sie,
Die Seele strömt hinaus,
Haucht ihre eigne Poesie
In holden Düften aus. Und kündet in dem linden Hauch,
Daß sie den Lenz verstand,
Daß sie das lichte Leben auch
Still liebte und empfand. So wandelt schöne Tage lang
Der Dichter wie im Traum,
Als hörte er des Lebens Klang,
Die tausend Stimmen kaum, Als blieb von Lenz und Glück und Licht
Allein er unbewegt,
Als würde seine Seele nicht
Zu Lieb' und Lust erregt."	l0020043	JOY#LOVE
924	Sonst und jetzt Rau, Heribert	"Doch ist mir Eins geblieben:
Ein Herz voll Glut,
Ein Geist voll Licht und Wärme,
Und Lebensmut!
Drum laßt die grauen Haare;
Was liegt daran!
Im Haar nicht ... in dem Herzen,
Da wohnt der Mann!"	1.0	0.0	0.0	0.0	0.0	0.0	"Sonst und jetzt
Rau, Heribert Einst sah mein junges Auge
Dem Falken gleich;
Da war mein Haar noch dunkel
Und lockenreich;
Da kannt' ich keine Sorgen
Und keinen Gram,
Bis in dem Sturm der Zeiten
Das Alter kam. Jetzt ist das Haar mir silbern
Und dünn und licht;
Dem sonst so scharfen Auge
Die Kraft gebricht.
Des Lebens rauhe Stürme,
So eisig kalt,
Sie machten mürb den Körper
Und müd und alt. Doch ist mir Eins geblieben:
Ein Herz voll Glut,
Ein Geist voll Licht und Wärme,
Und Lebensmut!
Drum laßt die grauen Haare;
Was liegt daran!
Im Haar nicht ... in dem Herzen,
Da wohnt der Mann!"	l00130252	AGITATION
3867	Spruch Jensen, Wilhelm l00160172	"Immer das Kommende sinnet der Mensch: in die herbstliche Stoppel,
Kaum von den Ähren noch leer, senkt er den Pflug für die Saat.
Dass er geerntet und dass er zu ernten erhofft, es verknüpft ihm
Morgen und Abend, und so schwindet der Mittag ihm hin."	0.0	0.0	0.0	1.0	0.0	0.0	"Spruch
Jensen, Wilhelm Immer das Kommende sinnet der Mensch: in die herbstliche Stoppel,
Kaum von den Ähren noch leer, senkt er den Pflug für die Saat.
Dass er geerntet und dass er zu ernten erhofft, es verknüpft ihm
Morgen und Abend, und so schwindet der Mittag ihm hin."	l00160172	JOY
6218	Solamen Freytag, Philipp	"Doch als ich, schwer getroffen,
Ins Knie danieder sank,
Ward Ohr und Herze offen
Für jenes Trostes Klang."	0.0	0.0	0.0	1.0	0.0	1.0	"Solamen
Freytag, Philipp Man pflegt zumeist im Leben
Nur sehr geringen Wert
Dem alten Spruch zu geben,
Der also uns gelehrt: Es diene den Elenden
Zum Troste allezeit,
Daß sie die Blicke wenden
Auf andrer Menschen Leid. Ich selber hielt zu jenen,
Die solchen Trost verlacht,
Als mir noch keine Thränen
Das Schicksal hatt' gebracht. Doch als ich, schwer getroffen,
Ins Knie danieder sank,
Ward Ohr und Herze offen
Für jenes Trostes Klang."	l00130114	JOY#SADNESS
3435	Und doch, obwohl ein jeder von sich strebt Rilke, Rainer Maria [alt. Rilke, Rainer-Maria]	"Und doch, obwohl ein jeder von sich strebt
wie aus dem Kerker, der ihn haßt und hält, —
es ist ein großes Wunder in der Welt:
ich fühle: alles Leben wird gelebt."	0.0	1.0	0.0	0.0	0.0	0.0	"Und doch, obwohl ein jeder von sich strebt
Rilke, Rainer Maria [alt. Rilke, Rainer-Maria] Und doch, obwohl ein jeder von sich strebt
wie aus dem Kerker, der ihn haßt und hält, —
es ist ein großes Wunder in der Welt:
ich fühle: alles Leben wird gelebt."	l00180130	ANGER
677	DIE LEIDENSCHAFTLICHEN FRANZ WERFEL l00300266	"Es werden ruhen, Gott, in deinen Tiefen
Nicht die allein, die deinen Namen riefen,
Nein alle, die in den Nächten nicht schliefen!
Die am Morgen ihr Herz mit beiden Händen häuften
Wie Flamme, und liefen
Tiefatmend, blind, in unbekannten Läuften.
Ein Küsten-Wind zuckt in Selbstmörderbriefen.
Die Knaben haben Meere nicht verstanden,
So brannten sie sich ab in Hieroglyphen.
Nun knarrt ein Rost-Schild an den schiefen
Eisernen Kreuzen der Konfirmanden.
Wie sehr wir hier sind, sind wir dort vorhanden –
Die hier unruheten aus deinen Tiefen,
Sie werden ruhen dort in deinen Tiefen."	1.0	0.0	0.0	0.0	0.0	0.0	"DIE LEIDENSCHAFTLICHEN Mein Gott, es werden sein zu deiner Rechten
Nicht die Wahrhaftigen allein und die Gerechten!
Nein alle, die in dreizehn Dezembernächten
Vor einem Fenster standen. Und Frauen, die sich rächten
Mit Vitriol und dann im Gerichtssaal ergrauten,
Die Eifersüchtigen all, die ihr Blut stauten,
In Droschken weinten, in Sälen sich erfrechten!
Die durchgefallnen tiefen Atmer,
Sänger, die mit bezechten
Gliedern dem Tod sich in die Grube schmissen,
Sie werden sein zu dir emporgerissen,
Und werden sitzen, Gott, zu deiner Rechten! Es werden wandeln in deinen Gärten
Nicht nur die Demütigen und Beschwerten,
Nein alle, die leuchteten und verehrten!
Mädchen, die in Konzerten erkrankten,
Weil ihre Wangen zu bleich sich verklärten,
Blicke aus Augen, die dankten –
Wahre Augen-Blicke zu nimmer verzehrten
Dauern aus Zeit in deine Zeiten gehoben,
Werden sie lodern weiter und loben,
Leichte Feuer wandelnd in deinen Gärten! Es werden ruhen, Gott, in deinen Tiefen
Nicht die allein, die deinen Namen riefen,
Nein alle, die in den Nächten nicht schliefen!
Die am Morgen ihr Herz mit beiden Händen häuften
Wie Flamme, und liefen
Tiefatmend, blind, in unbekannten Läuften.
Ein Küsten-Wind zuckt in Selbstmörderbriefen.
Die Knaben haben Meere nicht verstanden,
So brannten sie sich ab in Hieroglyphen.
Nun knarrt ein Rost-Schild an den schiefen
Eisernen Kreuzen der Konfirmanden.
Wie sehr wir hier sind, sind wir dort vorhanden –
Die hier unruheten aus deinen Tiefen,
Sie werden ruhen dort in deinen Tiefen."	l00300266	AGITATION
4695	Wie hold die Worte dir vom Munde gehn Frapan, Ilse	"Wie hold die Worte dir vom Munde gehn,
Von Weisheit voll und wie Musik zu hören;
Doch spür ich oft den Ton nur mich umwehn,
Und ihren Inhalt könnt ich nicht beschwören.
So fühl ich deine Nähe mich betören,
Daß meine Augen wie durch Nebel sehn;
Als ob die äußern Sinne sich verlören,
Weil mir im Herzen zu viel Glück geschehn.
Das pocht und jauchzt, als sprengt es mir die Brust!
Du bist's! du bist's! wie sucht ich dich vergebens!
Die ganze Welt durchsucht' ich, ach, nach dir!
Und du antwortest stumm und unbewußt:
Ich bin's, die einz'ge Liebe deines Lebens
Und dein Verhängnis; zittre nun vor mir!"	0.0	0.0	0.0	1.0	1.0	0.0	"Wie hold die Worte dir vom Munde gehn
Frapan, Ilse Wie hold die Worte dir vom Munde gehn,
Von Weisheit voll und wie Musik zu hören;
Doch spür ich oft den Ton nur mich umwehn,
Und ihren Inhalt könnt ich nicht beschwören.
So fühl ich deine Nähe mich betören,
Daß meine Augen wie durch Nebel sehn;
Als ob die äußern Sinne sich verlören,
Weil mir im Herzen zu viel Glück geschehn.
Das pocht und jauchzt, als sprengt es mir die Brust!
Du bist's! du bist's! wie sucht ich dich vergebens!
Die ganze Welt durchsucht' ich, ach, nach dir!
Und du antwortest stumm und unbewußt:
Ich bin's, die einz'ge Liebe deines Lebens
Und dein Verhängnis; zittre nun vor mir!"	l00140036	JOY#LOVE
